OBJECTID,BP_NO,STATUS,ADDRESS,UNIT_NO,DESCRIPTION,SCOPE,FILE_TYPE,BLDG_TYPE,APP_DETAIL,APPL_AREA,STOREYS,EST_CON_VALUE,RES_UNITS,DEMO,POSTAL_CODE,BLDG_NO,WARD,ZAREA,LATITUDE,LONGITUDE,APPLICATION_DATE,ISSUE_DATE,COMPLETE_DATE,latitude,longitude
18013,BP 9ALT 22-3065,COMPLETED -ALL INSP SIGNED OFF,1815 GREENVIEW CRT,,INSTALL (1) NEW ACCESSIBILITY ELEVATOR WITHIN EXISTING SFD,ALTERATION TO EXISTING BLDG,RESIDENTIAL,DETACHED DWELLING,,,,23000,,N,L5L 3W1,,8,31,43.55647132,-79.68221915,1658707200000,2022-09-09,1762128000000,43.55647131838607,-79.68221915383522
18153,BP 3ALT 22-3511,COMPLETED -ALL INSP SIGNED OFF,2345 CONFEDERATION PKY,,REPAIR TO PARKING GARAGE AND RETAINING WALL  INSTALL HANDRAIL,OTHER,RESIDENTIAL,APARTMENT (> 6 UNITS),,,,421000,,N,L5B 2H3,,7,15,43.57350926,-79.61224485,1660867200000,2022-09-20,1697673600000,43.57350925545119,-79.6122448527334
18155,BP 9ALT 22-3066,ISSUED PERMIT,4834 HURON HEIGHTS DR,,INSTALL (1) NEW ACCESSIBILITY ELEVATOR WITHIN EXISTING SFD,ALTERATION TO EXISTING BLDG,RESIDENTIAL,DETACHED DWELLING,,,,23000,,N,L4Z 4H8,,4,28,43.60937431,-79.6445421,1658707200000,2022-09-21,,43.60937431301239,-79.64454210226523
18196,FIRE 22-3176,COMPLETED -ALL INSP SIGNED OFF,15 FAIRVIEW RD E,,FIRE ALARM DEVICES UPGRADE FOR ELEVATOR EMERGENCY RECALL OPERATION,OTHER,RESIDENTIAL,APARTMENT (> 6 UNITS),,,,39000,,N,L5A 4C6,,4,21,43.58852305,-79.62710718,1659052800000,2022-09-23,1718064000000,43.588523052633285,-79.62710718123405
18273,FIRE 22-3179,COMPLETED -ALL INSP SIGNED OFF,1022 GREAVES AVE,,FIRE ALARM DEVICES UPGRADE FOR ELEVATOR  EMERGENCY RECALL OPERATION,OTHER,RESIDENTIAL,APARTMENT (> 6 UNITS),,,,39000,,N,L5E 3J4,,1,06,43.57183217,-79.5653331,1659052800000,2022-09-28,1718323200000,43.571832171356775,-79.56533310085563
18334,FIRE 22-3180,COMPLETED -ALL INSP SIGNED OFF,3020 QUEEN FREDERICA DR,,FIRE ALARM DEVICES UPGRADE FOR ELEVATOR  EMERGENCY RECALL OPERATION,OTHER,RESIDENTIAL,APARTMENT (> 6 UNITS),,,,39000,,N,L4Y 2Z8,,3,20,43.60698505,-79.58754836,1659052800000,2022-10-06,1727913600000,43.606985045526294,-79.58754835783256
18350,FIRE 22-3178,COMPLETED -ALL INSP SIGNED OFF,30 HANSON RD,,FIRE ALARM DEVICES UPGRADE FOR ELEVATOR  EMERGENCY RECALL OPERATION,OTHER,RESIDENTIAL,APARTMENT (> 6 UNITS),,,,39000,,N,L5B 3A7,,7,22,43.58571659,-79.62558726,1659052800000,2022-10-06,1718236800000,43.58571659253971,-79.62558725840152
18481,BP 9ALT 22-3130,ISSUED PERMIT,1767 GROSVENOR PL,,NEW FRONT ADDITION ABOVE EXISTING ATTACHED GARAGE  NEW REAR SECOND STOREY ADDITION AND NEW ELEVATOR,ADDITION TO EXISTING BLDG,RESIDENTIAL,DETACHED DWELLING,,98,,195000,,N,L5L 3V8,,8,24,43.55255908,-79.67837155,1658880000000,2022-10-18,,43.552559075127185,-79.67837155135466
18678,SEC UNIT 22-2099 SU,ISSUED PERMIT,3206 FLANAGAN CRES,,RESIDENTIAL SECOND UNIT IN THE BASEMENT WITH BELOW GRADE ENTRANCE RAMP IN THE FRONT YARD,ALTERATION TO EXISTING BLDG,RESIDENTIAL,DETACHED DWELLING,SECOND UNIT,135.7,,217000,1,N,L5C 2M5,,6,24,43.55576811,-79.65444294,1653350400000,2022-11-02,,43.5557681063355,-79.65444293504426
18732,BP 9ALT 21-9976,COMPLETED -ALL INSP SIGNED OFF,2179 ROBIN DR,,EXTERIOR ALTERATIONS - ADDITION OF ELEVATOR IN REAR YARD,ADDITION AND ALTERATION,RESIDENTIAL,DETACHED DWELLING,,,,140000,,N,L5K 2L5,,8,17,43.53133288,-79.64882354,1639526400000,2022-11-07,1709683200000,43.53133287886871,-79.64882353669677
18942,BP 9ALT 22-4571,COMPLETED -ALL INSP SIGNED OFF,562 CHANTENAY DR,,NEW ELEVATOR,ALTERATION TO EXISTING BLDG,RESIDENTIAL,SEMI-DETACHED DWELLING,,,,23000,,N,L5A 1G2,,7,14,43.58249614,-79.5904826,1667174400000,2022-11-22,1750377600000,43.58249614088098,-79.59048259650137
18973,BP 9ALT 22-4266,COMPLETED -ALL INSP SIGNED OFF,4252 HICKORY DR,,INTERIOR ALTERATIONS TO INSTALL AN ELEVATOR,ALTERATION TO EXISTING BLDG,RESIDENTIAL,DETACHED DWELLING,,,,23000,,N,L4W 1L2,,3,27,43.62549458,-79.61108109,1665619200000,2022-11-24,1730937600000,43.62549457559698,-79.61108109398405
18985,BP 9ALT 22-4828,COMPLETED -ALL INSP SIGNED OFF,2233 ROSEGATE DR,,ALTERATION WITHIN BASEMENT  GROUND AND SECOND FLOOR OF EXISTING SFD FOR NEW ELEVATOR,ALTERATION TO EXISTING BLDG,RESIDENTIAL,DETACHED DWELLING,,,,42000,,N,L5M 5A6,,11,39e,43.56661525,-79.70362657,1668643200000,2022-11-25,1678665600000,43.56661524918186,-79.70362657030823
19183,BP 3NEW 22-2212,COMPLETED -ALL INSP SIGNED OFF,3455 HAVENWOOD DR,,EXTERIOR BARRIER FREE RAMP & STAIRS,OTHER,RESIDENTIAL,ROW DWELLING,,,,54000,,N,L4X 2M7,,3,19,43.62081179,-79.59342337,1653955200000,2022-12-13,1729468800000,43.62081179399956,-79.59342336775407
19253,BP 3ALT 22-4576,COMPLETED -ALL INSP SIGNED OFF,92 WILLIAM ST,,NEW STAIR AND RAMP FOR EXISTING PORCH IN REAR YARD OF EXISTING BLDG,ADDITION AND ALTERATION,RESIDENTIAL,APARTMENT (> 6 UNITS),,,,38000,,N,L5M 1J5,,11,39e,43.58343464,-79.71870999,1666915200000,2022-12-19,1736380800000,43.58343464227638,-79.71870999410865
19290,FIRE 22-5140,COMPLETED -ALL INSP SIGNED OFF,39 STAVEBANK RD,,FIRE ALARM DEVICES UPGRADE FOR ELEVATOR EMERGENCY RECALL OPERATION,ALTERATION TO EXISTING BLDG,RESIDENTIAL,APARTMENT (> 6 UNITS),,,,77000,,N,L5G 4N7,,1,08,43.55375987,-79.58857539,1670889600000,2022-12-22,1685318400000,43.55375986625056,-79.58857539213524
19636,FIRE 23-5582,COMPLETED -ALL INSP SIGNED OFF,1535 LAKESHORE RD E,,FIRE ALARM SYSTEM UPGRADE ( ELEVATOR MODERNIZATION),OTHER,RESIDENTIAL,APARTMENT (> 6 UNITS),,,,90000,,N,L5E 3E2,,1,05,43.58914081,-79.54830795,1674086400000,2023-01-27,1706659200000,43.589140805231736,-79.54830795315101
19859,PLUMHOUS 23-5982,COMPLETED -ALL INSP SIGNED OFF,1903 OWLSNEST LANE,,ALTERATIONS WITHIN FIRST FLOOR OF EXISTING SFD  CONVERTING EXISTING CLOSET INTO BARRIER FREE SHOWER,ALTERATION TO EXISTING BLDG,RESIDENTIAL,DETACHED DWELLING,,,,23000,,N,L4W 2J1,,3,26,43.6391869,-79.59852582,1676246400000,2023-02-15,1677715200000,43.639186904055414,-79.5985258217244
19959,FIRE 23-5553,COMPLETED -ALL INSP SIGNED OFF,3900 CONFEDERATION PKY,,INSTALLATION OF (4) MAGLOCKS AT PARKING GARAGE ELEVATOR VESTIBULES,ELECTROMAG LOCK DEVICE,RESIDENTIAL,APARTMENT (> 6 UNITS),,,,20000,,N,,PH 1,7,22,43.58451316,-79.64472931,1674086400000,2023-03-01,1718582400000,43.584513156287386,-79.64472931277307
20012,BP 9ALT 23-6081,COMPLETED -ALL INSP SIGNED OFF,1298 BUNSDEN AVE,,REVISION TO PERMIT 22-1735 - ELIMINATE ELEVATOR  EXISTING STAIRCASE & SECOND FLOOR TO REMAIN AS-IS  RELOCATE HVAC GRILL ON GROUND FLOOR,ALTERATION TO EXISTING BLDG,RESIDENTIAL,DETACHED DWELLING,,,,0,,N,L5H 3T9,,8,17,43.54143891,-79.63431085,1676937600000,2023-03-07,1680652800000,43.541438910564786,-79.63431084531757
20837,BP 3ALT 23-6905,ISSUED PERMIT,6719 GLEN ERIN DR,,INTERIOR ALTERATIONS TO CONVERT EXISTING WASHROOM TO BARRIER FREE WASHROOM - TOTAL 25 UNITS,ALTERATION TO EXISTING BLDG,RESIDENTIAL,APARTMENT (> 6 UNITS),,,,128000,,N,L5N 3S6,,9,46w,43.58718677,-79.75885633,1681344000000,2023-05-11,,43.58718676531904,-79.7588563255836
21113,BP 3ALT 23-7373,ISSUED PERMIT,1100 CAVEN ST,,PARKING GARAGE RAMP REPAIR & WATERPROOFING - LOCALIZED GARAGE CONCRETE REPAIR,ALTERATION TO EXISTING BLDG,RESIDENTIAL,APARTMENT (> 6 UNITS),,,,43000,,N,L5G 4N3,,1,07,43.57039209,-79.57002122,1684195200000,2023-06-01,,43.57039208807052,-79.5700212193787
21115,BP 9ALT 23-7022,COMPLETED -ALL INSP SIGNED OFF,237 CHURCH ST,,INTERIOR ALTERATIONS TO INSTALL NEW ELEVATOR IN EXISTING SFD,ALTERATION TO EXISTING BLDG,RESIDENTIAL,ROW DWELLING,,,,23000,,N,L5M 1N1,,11,38w,43.5812289,-79.71091437,1682035200000,2023-06-02,1736985600000,43.5812288973116,-79.71091437363066
21743,FIRE 23-7511,COMPLETED -ALL INSP SIGNED OFF,1580 MISSISSAUGA VALLEY BLVD,,FIRE ALARM SYSTEM UPGRADE FOR ELEVATOR MODERNIZATION,OTHER,RESIDENTIAL,APARTMENT (> 6 UNITS),,,,39000,,N,L5A 3T8,,4,21,43.59137447,-79.62787541,1684886400000,2023-07-20,1716422400000,43.59137446569162,-79.62787540627595
21848,BP 9ALT 23-8365,COMPLETED -ALL INSP SIGNED OFF,24 BROADVIEW AVE,,REVISION TO PERMIT 22-2838 - INSTALL ELEVATOR,REVISIONS,RESIDENTIAL,SEMI-DETACHED DWELLING,,,,23000,,N,L5H 2S9,L,1,08,43.54217706,-79.59799198,1689552000000,2023-07-28,1724025600000,43.54217706322777,-79.59799198050379
21849,FIRE 23-6875,ISSUED PERMIT,2360 BONNER RD,,INSTALLATION OF SMOKE DETECTORS IN ELEVATOR LOBBY,FIRE CODE RETROFIT,RESIDENTIAL,APARTMENT (> 6 UNITS),,,,39000,,N,L5J 2C7,,2,11,43.51448335,-79.6478708,1681257600000,2023-07-28,,43.51448334714202,-79.64787079566531
22043,BP 9ALT 22-4486,ISSUED PERMIT,47 BEN MACHREE DR,47A,REVISION TO PERMIT 22-3559 - ADDITION OF HEATED ATTIC FLOOR   REVISED FRONT ELEVATION  & INTERIOR LAYOUT  NEW ELEVATOR,REVISIONS,RESIDENTIAL,DETACHED DWELLING,,98.13,,173000,,N,L5H 2S2,,1,08,43.54124465,-79.59167073,1666742400000,2023-08-15,,43.541244651125524,-79.59167073080383
23589,BP 9ALT 23-10557,COMPLETED -ALL INSP SIGNED OFF,878 SILVERTHORN MILL AVE,,INTERIOR ALTERATIONS TO INSTALL NEW ELEVATOR IN EXISTING SFD,ALTERATION TO EXISTING BLDG,RESIDENTIAL,DETACHED DWELLING,,,,22620,,N,L5W 1B2,,11,44w,43.62595072,-79.72041095,1702339200000,2023-12-19,1741219200000,43.625950720342026,-79.72041094641888
23703,BP 9ALT 23-10260,ISSUED PERMIT,145 ST. LAWRENCE DR,,REVISION TO 21-6626 - STRUCTURAL CHANGES AROUND ELEVATOR OPENING,ALTERATION TO EXISTING BLDG,RESIDENTIAL,ROW DWELLING,,,,11300,,N,,,1,07,43.55613328,-79.5784444,1700697600000,2024-01-03,,43.5561332793893,-79.5784443956189
23713,BP 9ALT 23-9558,COMPLETED -ALL INSP SIGNED OFF,2220 PARKER DR,,REVISION TO PERMIT 22-1616 - ALTERATIONS TO ADD NEW ELEVATOR & INTERIOR ALTERATIONS WITHIN SECOND FLOOR,ALTERATION TO EXISTING BLDG,RESIDENTIAL,DETACHED DWELLING,,,,121881,,N,L5B 1W2,,7,15,43.56581716,-79.61288756,1696550400000,2024-01-04,1727827200000,43.56581715668051,-79.61288755810237
24139,BP 9ALT 24-428,COMPLETED -ALL INSP SIGNED OFF,9 EARL ST,,REVISION TO BP 23-5892 - ALTERATIONS WITHIN ALL FLOORS INCLUDING FINISHING BASEMENT  NEW ELEVATOR & STRUCTURAL ALTERATIONS,ALTERATION TO EXISTING BLDG,RESIDENTIAL,DETACHED DWELLING,,,,152680,,N,L5M 1N6,,11,38w,43.58941578,-79.7196872,1706659200000,2024-02-16,1733443200000,43.58941577511993,-79.71968720384066
24580,FIRE 23-8432,ISSUED PERMIT,4983 RATHKEALE RD,,INSTALL SMOKE DETECTORS IN ELEVATOR LOBBIES AND CONNECT TO EXISTING FIRE CONTROL PANEL,OTHER,RESIDENTIAL,RESIDENTIAL - OTHER,,,,77000,,N,L5V 2B3,,6,30,43.57765657,-79.6826619,1689724800000,2024-03-28,,43.5776565690996,-79.68266190460771
24723,BP 9ALT 24-1189,COMPLETED -ALL INSP SIGNED OFF,3133 CLIPPERTON DR,,INTERIOR ALTERATIONS - INSTALL A HOMELIFT ELEVATOR  RELOCATE THE POWDER ROOM ON THE MAIN FLOOR,ALTERATION TO EXISTING BLDG,RESIDENTIAL,DETACHED DWELLING,,20,,22620,,N,L5M 0C2,,10,57,43.55196714,-79.72953668,1710979200000,2024-04-09,1717372800000,43.55196713619475,-79.72953668022761
24754,FIRE 24-1445,COMPLETED -ALL INSP SIGNED OFF,1271 WALDEN CIR,,ALTERATIONS TO FIRE ALARM SYSTEM.  ELEVATOR RECALL SYSTEM,OTHER,RESIDENTIAL,APARTMENT (> 6 UNITS),,,,100620,,N,L5J 4R4,,2,10,43.51283939,-79.62941328,1712275200000,2024-04-11,1767657600000,43.51283938748254,-79.62941328356497
25018,BP 9ALT 24-1447,COMPLETED -ALL INSP SIGNED OFF,1772 POETS WALK,,ALTERATIONS TO BASEMENT  GROUND  SECOND FLOOR OF EXISTING SFD. WALL REMOVAL AND NEW ELEVATOR,ALTERATION TO EXISTING BLDG,RESIDENTIAL,DETACHED DWELLING,,148.72,,88042,,N,L5M 4M4,,6,38w,43.58111685,-79.70392754,1712275200000,2024-05-02,1752537600000,43.581116847410726,-79.7039275351904
25078,BP 9ALT 24-377,ISSUED PERMIT,1362 LOCHLIN TR,,REVISION TO BP 23-8848 - ADDITION OF CAR LIFT IN GARAGE DOWN TO BASEMENT LEVEL  NEW UNHEATED STORAGE UNDER GARAGE  REAR DECK AND FLOOR STRUCTURE ALTERATIONS,REVISIONS,RESIDENTIAL,DETACHED DWELLING,,,,7599,,N,L5G 3V3,,1,07,43.56795983,-79.58539101,1706486400000,2024-05-09,,43.5679598327566,-79.58539101055844
25303,FIRE 24-2184,COMPLETED -ALL INSP SIGNED OFF,20 STRATHAVEN DR,,ALTERATIONS TO FIRE ALARM CONTROL PANEL FOR ELEVATOR MODERNIZATION,OTHER,RESIDENTIAL,APARTMENT (> 6 UNITS),,,,100620,,N,L5R 3R9,,5,37e,43.61019582,-79.65852097,1716422400000,2024-05-29,1730160000000,43.610195824445825,-79.65852097004172
25487,FIRE 24-2435,COMPLETED -ALL INSP SIGNED OFF,1800 THE COLLEGEWAY,,ALTERATIONS TO FIRE ALARM CONTROL PANEL FOR ELEVATOR MODERNIZATION,OTHER,RESIDENTIAL,APARTMENT (> 6 UNITS),,,,100620,,N,L5L 5S4,,8,24,43.54424039,-79.66815547,1717632000000,2024-06-13,1742860800000,43.54424038970782,-79.66815547217053
25653,BP 9ALT 24-970,ISSUED PERMIT,3420 ENNISKILLEN CIR,,SECOND STOREY & REAR ADDITION  INTERIOR ALTERATIONS  BARRIER FREE RAMP & NEW CANOPY FOR EXISTING PORCH IN FRONT YARD,ADDITION AND ALTERATION,RESIDENTIAL,DETACHED DWELLING,,134,,473008,,N,L5C 2N1,,6,24,43.5574266,-79.65958314,1709856000000,2024-06-27,,43.557426600805016,-79.65958313705474
26119,BP 9ALT 24-2112,COMPLETED -ALL INSP SIGNED OFF,1987 BALSAM AVE,,REVISION TO BP 23-6935 - CHANGES TO LAYOUTS  NEW ELEVATOR  NEW ROOF COVER FOR SIDE BELOW GRADE ENTRANCE  NEW REAR BALCONY TO COVER PORCH BELOW,ALTERATION TO EXISTING BLDG,RESIDENTIAL,DETACHED DWELLING,,141.34,,128393,,N,L5J 1L3,,2,10,43.51535155,-79.63280777,1715904000000,2024-08-07,1751932800000,43.515351550109706,-79.63280776986832
26812,BP 9ALT 24-3218,COMPLETED -ALL INSP SIGNED OFF,110 ST. LAWRENCE DR,,NEW ELEVATOR ON GROUND & SECOND FLOOR,ALTERATION TO EXISTING BLDG,RESIDENTIAL,CONDOMINIUM ROW DWELLING,,10,,22620,,N,,,1,07,43.55557993,-79.57903506,1722211200000,2024-09-25,1748390400000,43.55557993107276,-79.57903505832206
26839,BP 3NEW 24-3437,COMPLETED -ALL INSP SIGNED OFF,4150 WESTMINSTER PL,,ALTERATIONS TO REPLACE ENTRANCE STAIRS & RAMP IN FRONT YARD - ST LUKES DIXIE SENIOR RESIDENCE,ALTERATION TO EXISTING BLDG,RESIDENTIAL,APARTMENT (> 6 UNITS),,90,,77740,,N,L4W 3Z7,,3,27,43.6150239,-79.6190491,1723507200000,2024-09-26,1751846400000,43.615023899413984,-79.61904909973333
27771,BP 9ALT 24-4973,COMPLETED -ALL INSP SIGNED OFF,3341 SUNDEW CRT,,(1) STOREY ADDITION IN SIDE YARD  NEW CRAWL SPACE  NEW SIDE DOOR  NEW DECK IN REAR YARD WITH LIFT,ADDITION AND ALTERATION,RESIDENTIAL,DETACHED DWELLING,,21.2,,78837,,N,L5N 5X6,,10,56,43.56417651,-79.75643737,1731283200000,2024-12-03,1768262400000,43.56417651482653,-79.75643737410985
28495,BP 3NEW 25-5757,COMPLETED -ALL INSP SIGNED OFF,927 MEADOW WOOD RD,,NEW ACCESSIBLE RAMP IN FRONT YARD,ALTERATION TO EXISTING BLDG,RESIDENTIAL,RESIDENTIAL - OTHER,,45,,48750,,N,L5J 2S7,,2,03,43.51748986,-79.61804605,1736294400000,2025-02-03,1752451200000,43.517489855193496,-79.61804604597992
28576,BP 3ALT 25-6112,ISSUED PERMIT,1500 GRAZIA CRT,,REPAIRS TO PARKING GARAGE RAMP  MECHANICAL PENTHOUSE  ROOF FRAMING  AND ROOF ANCHORS,OTHER,RESIDENTIAL,APARTMENT (> 6 UNITS),,250,,88790,,N,L4W 4Z9,,3,26,43.62836169,-79.60564854,1737676800000,2025-02-13,,43.62836168877101,-79.60564853944291
28703,BP 9ALT 23-10686,ISSUED PERMIT,137 BRIARHILL DR,,REPLACEMENT PROJECT for BP 9ALT 18-3000 - REVISION TO PERMIT 17-5375 - BASEMENT LAYOUT CHANGES  ADDITION OF VEHICLE LIFT IN GARAGE & MINOR HVAC REVISIONS,OTHER,RESIDENTIAL,DETACHED DWELLING,,,,38480,,N,L5G 2N3,,1,07,43.56842044,-79.59267118,1703116800000,2025-02-26,,43.568420444908014,-79.59267118054083
29084,BP 9ALT 25-6683,COMPLETED -ALL INSP SIGNED OFF,4092 FARNSWORTH CRES,,INTERIOR ALTERATION TO INSTALL A HOME LIFT,ALTERATION TO EXISTING BLDG,RESIDENTIAL,DETACHED DWELLING,,,,30810,,N,L5L 3Z2,,8,58,43.53376235,-79.70736597,1741046400000,2025-03-31,1757548800000,43.53376234784649,-79.70736597433189
29199,BP 9ALT 25-6579,COMPLETED -ALL INSP SIGNED OFF,2297 YORKTOWN CIR,,INSTALL AN ELEVATOR LIFT INSIDE THE HOUSE,ALTERATION TO EXISTING BLDG,RESIDENTIAL,DETACHED DWELLING,,20,,11840,,N,L5M 5Y1,,11,39e,43.57285962,-79.71632926,1740528000000,2025-04-09,1748476800000,43.57285962107403,-79.71632926077504
29658,BP 9ALT 23-9789,ISSUED PERMIT,3091 BONAVENTURE DR,,REVISION TO PERMIT 22-1586 - FINISH BASEMENT  NEW BELOW GRADE STAIRWELL IN REAR YARD & INTERIOR ELEVATOR  REVISED MAIN & 2ND FLOOR LAYOUT & FLATROOF,REVISIONS,RESIDENTIAL,DETACHED DWELLING,,202.88,,114627,,N,L4T 2J4,,5,48w,43.71579257,-79.65461893,1698019200000,2025-05-16,,43.71579256842371,-79.65461892994638
29816,BP 9NEW 25-6429,ISSUED PERMIT,194 INDIAN VALLEY TR,,DEMOLISH EXIST ATTACHED GARAGE & PARTIAL SECOND FL  RECONSTRUCTION OF DEMOLISHED AREAS INCL NEW BELOW GRADE CAR LIFT IN GARAGE,ALTERATION TO EXISTING BLDG,RESIDENTIAL,DETACHED DWELLING,,155.95,2,497208,,N,L5G 2K6,,1,08,43.56012357,-79.59879511,1739491200000,2025-05-30,,43.56012357424885,-79.59879510500984
29822,BP 9ALT 22-5175,COMPLETED -ALL INSP SIGNED OFF,1016 MISSISSAUGA HEIGHTS DR,,ALTERATION TO ADD NEW FRONT PORCH W/ LIFT PLATFORM OF EXISTING SFD,ALTERATION TO EXISTING BLDG,RESIDENTIAL,DETACHED DWELLING,,20.9,,22360,,N,L5C 1A6,,7,16,43.55123025,-79.63103901,1671148800000,2025-06-02,1750982400000,43.55123024575158,-79.6310390126791
29846,BP 3ALT 24-4168,COMPLETED -ALL INSP SIGNED OFF,5105 HURONTARIO ST,,REVISION TO BP 22-3528 - INTERIOR & EXTERIOR ALTERATIONS FOR NEW CORRIDOR & ELEVATOR PENTHOUSE,ALTERATION TO EXISTING BLDG,RESIDENTIAL,APARTMENT (> 6 UNITS),,915,,789880,,N,L4Z 0C9,A,5,36w,43.60911999,-79.65497227,1727136000000,2025-06-03,1768780800000,43.60911999119672,-79.65497227049123
30034,BP 9ALT 25-6970,COMPLETED -ALL INSP SIGNED OFF,2630 MISSISSAUGA RD,,REVISION TO PERMIT 21-6934 - INTERIOR & EXTERIOR ALTERATIONS INCLUDING NEW ELEVATOR,ALTERATION TO EXISTING BLDG,RESIDENTIAL,DETACHED DWELLING,,267.4,,158301,,N,L5H 2L5,,8,17,43.53521618,-79.6503919,1742428800000,2025-06-17,1772064000000,43.53521617651533,-79.65039189842113
30173,BP 9ALT 24-5258,ISSUED PERMIT,505 COMANCHE RD,,ADDITION TO 2ND FLOOR  EXTERIOR AND INTERIOR ALTERATIONS TO ALL FLOORS  NEW REAR DECK  NEW ELEVATOR,ADDITION AND ALTERATION,RESIDENTIAL,DETACHED DWELLING,,18.85,,437077,,N,L5H 3R1,,2,08,43.55417274,-79.60644821,1732665600000,2025-06-26,,43.55417274469783,-79.60644821267567
30314,BP 9ALT 24-3220,ISSUED PERMIT,157 HARBORN TR,,REVISION TO BP 23-10538 - PROPOSE STORAGE SPACE ABOVE BASEMENT RAMP  COVERED ROOF OVER REAR DECK,REVISIONS,RESIDENTIAL,DETACHED DWELLING,,35,,76570,,N,L5B 1A7,,7,15,43.56706448,-79.60643513,1722211200000,2025-07-08,,43.5670644832509,-79.60643513087388
30593,BP 9ALT 25-8774,ISSUED PERMIT,1556 HAMPSHIRE CRES,,INTERIOR ALTERATIONS TO THE BSMT  FIRST & SECOND FLOOR  ADD ELEVATOR TO ACCOMODATE ALL FLOORS,ALTERATION TO EXISTING BLDG,RESIDENTIAL,DETACHED DWELLING,,52.5,,31080,,N,L5G 4S9,,1,08,43.56473418,-79.59784093,1751932800000,2025-07-29,,43.56473418117261,-79.59784092720554
30811,BP 3NEW 25-8511,COMPLETED -ALL INSP SIGNED OFF,2580 SHARON CRES,,NEW FRONT YARD DECK WITH RAMP - ALZHEIMER SOCIETY OF PEEL,ALTERATION TO EXISTING BLDG,RESIDENTIAL,DETACHED DWELLING,,,,48750,,N,L5C 1Y8,,7,16,43.55566075,-79.64214501,1750291200000,2025-08-15,1769731200000,43.55566075088229,-79.64214501220081
30917,FIRE 25-9194,COMPLETED -ALL INSP SIGNED OFF,30 HIGH ST E,,FIRE ALARM SYSTEM UPGRADE (ELEVATOR MODERNIZATION),OTHER,RESIDENTIAL,APARTMENT (> 6 UNITS),,,,100620,,N,L5G 1J8,,1,08,43.55342433,-79.58620577,1753833600000,2025-08-26,1770854400000,43.553424325803036,-79.58620577380879
31676,BP 3ALT 25-9102,ISSUED PERMIT,1330 MISSISSAUGA VALLEY BLVD,,CONCRETE REPAIRS TO EXTERIOR RAMP,ALTERATION TO EXISTING BLDG,RESIDENTIAL,CONDOMINIUM ROW DWELLING,,,,48750,,N,L5A 3T1,,4,21,43.59786544,-79.62750406,1753401600000,2025-10-31,,43.597865438883304,-79.62750405946355
32209,FIRE 25-9479,ISSUED PERMIT,25 PAISLEY BLVD W,,FIRE ALARM PANEL INSTALLATION AND ELEVATOR MODIFICATION,OTHER,RESIDENTIAL,APARTMENT (> 6 UNITS),,,,100620,,N,L5B 1E3,,7,15,43.57578449,-79.61102612,1755475200000,2025-12-18,,43.57578449242425,-79.61102611857234
33001,BP 9ALT 26-312,ISSUED PERMIT,4935 MAXINE PL,,""" CANCELLATION REQUEST SENT TO INSPECTION""  INTERIOR ALTERATIONS TO BASEMENT  FIRST & SECOND FLOOR  INSTALL NEW ELEVATOR",ALTERATION TO EXISTING BLDG,RESIDENTIAL,DETACHED DWELLING,,27.5,,16280,,N,L4Z 4H9,,4,28,43.6107716,-79.64469705,1769558400000,2026-03-16,,43.61077160287879,-79.6446970474285
33056,BP 9ALT 26-816,ISSUED PERMIT,3341 SUNDEW CRT,,NEW ELEVATOR IN EXISTING GARAGE,ALTERATION TO EXISTING BLDG,RESIDENTIAL,DETACHED DWELLING,,,,31720,,N,L5N 5X6,,10,56,43.56417651,-79.75643737,1773014400000,2026-03-20,,43.56417651482653,-79.75643737410985
33351,BP 3NEW 25-9437,ISSUED PERMIT,1111 FORESTWOOD DR,,INTERIOR ALTERATION TO CONVERT STORAGE SPACE TO (12) DWELLING UNITS (8 ON GROUND FLOOR & 4 IN THE BASEMENT) WITH EXTERIOR NEW BARRIER-FREE RAMP,ALTERATION TO EXISTING BLDG,RESIDENTIAL,APARTMENT (> 6 UNITS),,453.9,,1435631,12,N,L5C 1H3,,6,23,43.55884101,-79.647058,1755129600000,2026-04-16,,43.55884100710517,-79.6470580037549
33397,FIRE 26-420,ISSUED PERMIT,120 ACORN PL,,FIRE ALARM SYSTEM UPGRADE FOR ELEVATOR MODERNIZATION,OTHER,RESIDENTIAL,APARTMENT (> 6 UNITS),,,,103610,,N,L4Z 3N5,,4,28,43.60512331,-79.64384331,1770249600000,2026-04-21,,43.6051233130716,-79.64384330735668
33484,BP 9ALT 26-773,ISSUED PERMIT,5248 FORESTWALK CIR,,FINISHED BASEMENT  INSTALL AN ELEVATOR TO ACCOMODATE ALL FLOORS,ALTERATION TO EXISTING BLDG,RESIDENTIAL,DETACHED DWELLING,,33,,19536,,N,L4Z 4A3,,5,36w,43.61705896,-79.65098209,1772668800000,2026-05-04,,43.61705896089999,-79.6509820938688
