address,parsed_house_number,parsed_street_name,neighbourhood,ward,keywords,total_permits,n_building_permits,n_development_permits,building_row_ids,development_file_numbers,sample_description
1050 YONGE ST,,,,,lift,6,6,0,23 190952 HVA; 23 190952 BLD; 23 190952 BLD; 23 190952 PLB; 23 190952 HVA; 23 190952 PLB,,HVAC REVISION#1: Install elevator from basement to third floor; enclose third floor courtyard; convert second and third floors to residential use by creating separate entry on ground floor and closing off ground floor access to rotunda; For revision to permit - new skylight at third floor; larger elevator; create shared exit stair at rear of buildingHVAC - Install elevator from basement to third floor; enclose third floor courtyard; convert second and third floors to residential use by creating separate entry on ground floor and closing off ground floor access to rotunda;
133-135 THE WEST MALL,,,,,barrier-free,4,4,0,22 129115 PLB; 22 129115 BLD; 22 129115 HVA; 22 129115 BLD,,"Plumbing  - Construct new offices, new lab, new universal barrier free toilet room"
20 VANAULEY ST,,,,,barrier-free; ramp,4,4,0,20 150216 BLD; 20 150216 BLD; 20 150216 BLD; 20 150216 HVA,,"Rev 03:Smaller office space, Rec. Room to remain as is (finishes only updated), reconfiguration of Barrier-Free washroom at 2nd fl; Storage at basement to remain as is (finishes only updated) and new structural remediation at Entrance.New TCHC office space for tenant's services in existing residential building.REVISION:  Smaller office space, Rec. Room to remain as is (finishes only updated), reconfiguration of Barrier-Free washroom at 2nd fl; Storage at basement to remain as is (finishes only updated) and new structural remediation at Entrance. Rev 02 - New tenant kitchen, Laundry not relocated, Rec. Room converted to Office space & Multipurpose.Revision 01: laundry room reconfiguration and exhaust - new glazing at the second floor.[Proposal for interior alterations for a new TCHC office space for tenant's services in an existing residential apartment building. Renovations to accommodate new office space on the second floor by moving the existing laundry room from the second floor to the ground floor, with a new breakroom at the ground level. ]"
22 WALMER RD,,,,,ramp,4,4,0,17 116276 BLD; 14 148199 HVA; 14 148199 BLD; 14 148199 PLB,,"Proposal for railing replacement at garage entrance ramp, see related permit 14-148199 BA for concrete repair."
25 MABELLE AVE,,,,,ramp,3,3,0,22 101323 BLD; 22 101323 BLD; 22 101323 BLD,,"Proposal for new vehicle driveway, new entrance ramp, new retaining wall, and new concrete stair  to existing 3 level underground parking garage."
2 HARVARD AVE,,,,,accessible,2,2,0,19 169185 BLD; 19 169185 HVA,,"Proposal for a new roof deck and rooftop penthouse to access deck, deck is accessible from only 1 of the 6 units."
20 GRAYDON HALL DR,,,,,accessible; ramp; wider doorway,2,2,0,26 127584 BLD; 16 111440 BLD,,Construction of an accessibility ramp in the lobby
20 GRENADINE CRT,,,,,barrier-free,2,2,0,13 205971 BLD; 13 205971 PLB,,Interior alterations to create barrier free bathroom at the basement floor level to semi-detached single family dwelling.
40 GORDONRIDGE PL,,,,,accessible; automatic door; ramp,2,2,0,22 148232 BLD; 22 148232 BLD,,"Parking garage roof deck and P1 level concrete repairs including localized topside, soffit, through-slab and vertical surfaces. Full slab replacement at select bays of roof deck and P1 level slabs. Installation of concrete pedestrian accessibility ramp on P2 level entrance to building and replace two P2 level doors at building with automatic doors.Replacement and addition of site light standards at grade above parking garage roof deck."
45 SILVERSTONE DR,,,,,ramp,2,2,0,10 193728 BLD; 10 193728 BLD,,**Revision 01 - Change to structure of ramp on one side. Proposed reconstruction of existing parking garage entrance ramp at existing apartment building.Repair of stairs and first level for under ground parking
50 TUXEDO CRT,,,,,ramp,2,2,0,16 102323 FSU; 16 102323 PLB,,"FS - Sprinkler Shop Drawing - ADD NEW CONCRETE RAMP & STAIR, CANOPY TO EXTERIOR FRONT ELEVATION, INTERIOR ALTERATIONS AT REAR ENTRANCE, LOBBY, LAUNDRY ROOMS, 16FLR W/C & KITCHENETTE"
6 GLAMORGAN AVE,,,,,accessible; ramp,2,2,0,11 320018 BLD; 11 320018 BLD,,"common area accessibility upgrades, lobby ramp, w/c, parking"
7 ST DENNIS DR,,,,,ramp,2,2,0,26 114326 STS; 25 188059 BLD,,"Proposal for additional drains in the underground parking garage due relocation of the entry/exit ramp - installation of new trench drain and related piping, installation of new storm sump pit, installation of new floor drain and piping."
1 RAINSFORD RD,,,,,ramp,1,1,0,25 236412 BLD,,"Proposal for installation of new structural steel beams below podium deck areas complete with fireproofing. Localized concrete repairs at podium deck slabs and beams. South podium deck waterproofing replacement, and traffic deck coating replacement at north podium and garage ramp. Replace trench drain and expansion joint. Install crack injection and crystalline waterproofing."
10 BROADWAY AVE,,,,,ramp,1,1,0,17 226083 BLD,,"Isolated concrete repairs to the garage roof slab, garage entrance ramp and intermediate concrete slab."
10 CARABOB CRT,,,,,ramp,1,1,0,18 261263 BLD,,Proposed garage slab repair and reconstruction of new ramp.
10 ESTERBROOKE AVE,,,,,handrail; ramp,1,1,0,25 206701 BLD,,"Localized concrete repairs to the garage, new pedestrian stairs and ramp, new guards and handrails at stairs"
10 HUMBERLINE DR,,,,,ramp,1,1,0,13 154865 BLD,,Garage ramp repairs to underground parking
11 NEILSON DR,,,,,ramp,1,1,0,17 175821 BLD,,Parking garage access ramp repair and roof deck expansion joint repair.
11 STRATHGOWAN CRES,,,,,lift,1,1,0,23 193518 BLD,,"Proposal to construct new two storey Single Family Dwelling with finished basement, integral garage with car lift: modifications made to plans (refer to 23 105765 ZAP 00 ZR)"
15 LA ROSE AVE,,,,,ramp,1,1,0,10 142572 BLD,,"Repairs to roof of underground garage, stairwells, parking ramp located at rear yard"
15 SCADDING AVE,,,,,ramp,1,1,0,25 267520 BLD,,"Localized concrete, masonry, and waterproofing repairs to restore the structural integrity and watertightness in the parking garage. The project also includes the replacement of the garage¿s entrance ramp radiant electric heated concrete topping."
15 TWENTY FOURTH ST,,,,,lift; wheelchair,1,1,0,18 112871 BLD,,-PROPOSED FRONT ADDITION & FRONT PORCH w/ WHEELCHAIR LIFT + INTERIOR ALTERATIONS
155 A RUSHOLME RD,,,,,ramp,1,1,0,24 213126 BLD,,"PROPOSED ONE STOREY ADDITION, VERANDAH, BASEMENT ENTRANCE AND RAMP AT REAR & INSTALL PLUMBING FIXTURES"
16 MC GEE ST,,,,,accessible; barrier-free; lift,1,1,0,23 236560 BLD,,"Proposal to construct a new three storey rear addition, a new front porch with stairs, a new front yard barrier-free accessibility lift and carry out interior alterations throughout the existing townhouse single family dwelling."
16 THE LINKS RD,,,,,ramp,1,1,0,26 121765 BLD,,"Proposal to restore parking garage retaining walls, ramp, concrete, asphalt and site features."
17 CENTENNIAL PARK RD,,,,,ramp,1,1,0,15 230217 BLD,,Permit to recostruct/repair damaged parking ramp wall.
19 HABITANT DR,,,,,lift; wheelchair,1,1,0,13 227396 BLD,,Proposal to extend the existing front porch across the front of the house and to add an exterior wheelchair lift to existing 1 storey sfd-semi detached
19 TOPHAM RD,,,,,lift,1,1,0,24 124041 BLD,,"Proposal to demolish existing detached dwelling and construct a new two storey detached dwelling with an integral garage with a car lift, front porch, rear deck and a finished basement."
21 VAUGHAN RD,,,,,ramp,1,1,0,12 256516 BLD,,Proposal to repair garage roof slab and ramp of existing apartment building.
22 OAKMOUNT RD,,,,,ramp,1,1,0,19 191610 BLD,,"Ramp removal, construction of new concrete ramp,, concrete slab alterations/repairs"
28 HARRISON GARDEN BLVD,,,,,ramp,1,1,0,21 188434 BLD,,Proposal to relocate garage door at the garage ramp of existing apartment building.
32 CURZON ST,,,,,ramp,1,1,0,25 209584 BLD,,Proposal for garage ramp repairs
34 LOTHIAN AVE,,,,,lift,1,1,0,13 179961 BLD,,To construct new two storey single family detached dwelling with integral garage (With car lift pit in basement).
35 EMPRESS AVE,,,,,ramp,1,1,0,22 135770 BLD,,Proposal for localized concrete and waterproofing repairs to entrance and exit ramp.
38 BUCKINGHAM AVE,,,,,lift,1,1,0,22 239253 BLD,,"Proposal to demolish existing dwelling to construct new 2 storey Single Family Dwelling with finished walkout basement, integral garage with car lift, front porch, rear deck and second storey balcony"
44 ST JOSEPH ST,,,,,ramp,1,1,0,19 187182 BLD,,"Proposed garage concrete slab repairs. Also includes waterproofing repairs, and removal and replacement of ramp topping and heating cables."
697 B DANFORTH RD,,,,,accessible; wheelchair,1,1,0,17 100264 BLD,,"Enclose front porch to accommodate wheelchair storage, and to permit a widened accessible walkway adjacent to the driveway"
8 CORINTH GDNS,,,,,wheelchair,1,1,0,14 146150 BLD,,install a new door at the existing window location for wheelchair access
8 MONDEO DR,,,,,ramp,1,1,0,18 153289 BLD,,Parking Garage Ramp Repairs 8 & 18 Mondeo Drive
8 TELEGRAM MEWS,,,,,ramp,1,1,0,26 111189 BLD,,Restoration work - concrete repairs at P1 ramp including waterroofing membrane repairs.
8 WINDMILL RD,,,,,ramp,1,1,0,21 233547 BLD,,construct access ramp at front
9 ASHDEAN DR,,,,,ramp,1,1,0,07 204431 BLD,,Rear one storey addition plus deck and ramp
