_id,no_demande,id_permis,date_debut,date_emission,emplacement,arrondissement,code_type_base_demande,description_type_demande,description_type_batiment,description_categorie_batiment,nature_travaux,nb_logements,longitude,latitude,loc_x,loc_y,rank
292943,3001645336,3000868916,2019-09-10,2019-09-10,2025  rue Peel,Ville-Marie,TR,Travaux extérieurs-intérieurs,Commercial,Mixte,"Suite au permis 3000749638-18, au s-s et r-c, réaménager en éliminant l'ascenseur (retrait de 9 unités de stationnement et ajout de 26 unités de vélos au s-s), au r-c, agrandir de 15.5m²  le restaurant et débit de boissons alcooliques et réaménager les W-C et salles à déchets et recyclage), au mur arr., modifier les ouvertures et persiennes, selon plans approuvés",0,-73.57509697946665,45.50137071548323,298931.29,5040163.73,0.057308756
466894,1001807804,1000708304,2004-11-02,2004-12-02,15200  rue Sherbrooke Est,Rivière-des-Prairies - Pointe-aux-Trembles,TR,Transformation,Gouvernemental,Edifice gouvernemental,"AGRANDISSEMENT DE L'ÉCOLE SUR 2 ÉTAGES, SANS SOUS-SOL, AVEC ASCENSEUR,  RÉTENTION AU TOÎT, ET NEUF CASES DE STATIONNEMENT SUR LE COTÉ GAUCHE.",0,-73.49961650448051,45.68498834260341,304829.87,5060566.83,0.057308756
287828,3001478090,3001149153,2018-12-06,2020-09-30,555  rue Saint-Ferdinand,Le Sud-Ouest,TR,Transformation,Équi.Colle. et Institutionnels,Dépendance,Ajout de 2 édicules et de 2 ascenseurs (Métro Saint Henri).,0,,,,,0.057308756
394230,3003329193,3001663754,2023-12-11,2024-01-24,6925  rue Jean-Talon Est,Saint-Léonard,TR,Transformation,Commercial,Commerce artériel léger,"Réaménagement intérieur, ajout d'un ascenseur, remplacement du revêtement de plancher.",0,-73.57244003847273,45.5963372341626,299148.46,5050717.3,0.057308756
28151,3000070476,3000023632,2007-05-29,2007-06-05,677  rue Sainte-Catherine Ouest,Ville-Marie,TR,Transformation,Commercial,Edifice à bureau,"3E ÉTAGE, AMÉNAGEMENT D'UN LOCAL ÉLECTRIQUE DANS LA SUITE 310, RÉAMÉNAGEMENT DU HALL D'ASCENSEUR, AGRANDIR LES SALLES DE TOILETTES EXISTANTES",0,,,,,0.057308756
160594,3000939323,3000439783,2015-01-19,2015-01-19,352  rue Sainte-Catherine Ouest,Ville-Marie,TR,Travaux intérieurs,Commercial,Commercial,"Au RC et 2 étage, ajouter un escalier et un ascenseur reliant les 2 étages et aménager le local pour la «RBC».Tel que plans approuvés.",0,-73.56708984817455,45.50566173734527,299557.44,5040640.04,0.057308756
144358,3000733368,3000358140,2013-11-26,2014-04-07,3964  rue Notre-Dame Ouest,Le Sud-Ouest,TR,Transformation,Commercial,Commercial,"Au rez-de-chaussée, réaménagement intérieur d'un hall d'entrée et d'un ascenseur.",0,-73.58312011091107,45.477528525553446,298301.56,5037514.76,0.057308756
11280,3000031732,3000010188,2005-12-21,2005-12-21,1355  boulevard René-Lévesque Ouest,Ville-Marie,TR,Transformation,Commercial,Commercial,"AJOUT D'UNE MARQUISE EN FAÇADE, RÉNOVATION DES ASCENSEURS ET DE L'APENTIS, TRAVAUX DE RESTAURATION.",0,-73.57330416860458,45.49629668780543,299070.89,5039599.72,0.057308756
43972,3000129814,3000041277,2009-02-11,2009-02-16,2157  rue du Centre,Le Sud-Ouest,TR,Transformation,Équi.Colle. et Institutionnels,Edifice du culte,"À l'intérieur, modification au plancher d'une issue et pose d'un ascenseur; aucune intervention à l'extérieur",0,-73.56588119975648,45.48120921676596,299649.66,5037922.54,0.057308756
470675,1000332091,1000408491,1991-06-12,1991-08-14,6720  rue Garnier,Rosemont - La Petite-Patrie,TR,Transformation,Industriel,Industriel,"REMPLACEMENT D'UN ASCENSEUR DANS LA LAITERIE DE 2 ETAGES, TQP",0,-73.60221791959799,45.543194358893984,296817.75,5044813.97,0.057308756
470033,1000006795,1000070695,1995-01-05,1995-02-02,1010  rue De La Gauchetière Ouest,Ville-Marie,TR,Transformation,Commercial,Edifice à bureau,"REMISE AUX NORMES DU BATIMENT, SECTION 10.2, R.R.V.M.C.B-1.             AMENAGER ACCES A L'ASCENSEUR POMPIER.",0,-73.56726471501632,45.4980994798593,299543.07,5039799.65,0.057308756
469401,1000775896,1000427196,1996-05-06,1996-05-21,100  rue Sainte-Catherine Ouest,Ville-Marie,TR,Transformation,Commercial,Commercial,FAIRE 4 PORTES POUR ASCENSEURS AU 30E ETAGE TOUR SUD,0,-73.56495787705859,45.508569187796226,299724.3,5040963.01,0.057308756
465145,1000441401,1000295801,2001-03-19,2001-03-20,6460  boulevard Saint-Laurent,Rosemont - La Petite-Patrie,TR,Transformation,Commercial,Edifice à bureau,"BATIMENT, INSTALLER UN ASCENSEUR. FACADE DANS LE HALL D'ENTREE,REMPLACERUNE MARCHE PAR UNE PENTE POUR ACCES AUX PERSONNES HANDICAPEES.",0,-73.60900429957628,45.53044411194105,296285.88,5043397.71,0.057308756
463928,1001063101,1000900101,2001-06-12,2001-07-19,1  place Ville-Marie,Ville-Marie,TR,Transformation,Commercial,Edifice à bureau,"AU 2E ETAGE, (FACE ASCENSEUR 45-46-47, TRANSFORMER UNE SUITE EN 2 SUITESREAMENAGER ESPACE A BUREAU.",0,-73.57009033252882,45.50145280568291,299322.56,5040172.5,0.057308756
391119,3003447395,3001789934,2024-08-28,2024-11-08,20  boulevard Crémazie Est,Villeray - Saint-Michel - Parc-Extension,TR,Transformation,Commercial,Commercial,"EN COUR LATÉRALE, AJOUTER UN NOUVEL ASCENSEUR POUR DESSERVIR LES 3 AIRES DE PLANCHER EXISTANTES, TEL QUE DOCUMENTS SOUMIS.",0,-73.6401886414386,45.541884946421,293852.35,5044672.93,0.057308756
464858,1000468993,1000496993,1993-09-20,1993-10-21,360  rue Saint-Jacques,Ville-Marie,TR,Transformation,Commercial,Edifice à bureau,"MISE AUX NORMES DU REGLEMENT #8399 ,GICLEURS,GENERATRICE,SYST.DETECTION ALARME INCENDIE+ASCENSEUR POMPIER,VENTILATION DU 2IEME SS A L'APPENTIS",0,-73.55935943080895,45.50262914965852,300161.26,5040302.55,0.057308756
388487,3003327866,3001656833,2023-12-05,2023-12-12,4707  rue Levy,Saint-Laurent,TR,TR Transformations Int / Ext,INDUSTRIE,I3 Manufacturière,"MODIFICATIONS INTÉRIEURES ET EXTÉRIEURES SOIT; AMÉNAGER DES ESPACES DE BUREAUX AU 1ER ÉTAGE ET AU 2ÈME ÉTAGE, AJOUTER UN ASCENSEUR INTÉRIEUR, MODIFIER DES QUAIS DE CHARGEMENT, AJOUTER UNE UNITÉ MÉCANIQUE AU TOIT - (SUPPRIMER LES NUMEROS CIVIQUES 4727, 4737 ET 4747 RUE LEVY ET SUPPRIMER LE NUMÉRO CIVIQUE 4915 RUE MARC-BLAIN)",0,-73.7322529262731,45.49243833683054,286646.95,5039194.57,0.057308756
218544,3001129629,3000540386,2016-04-18,2016-04-26,6000  avenue Fielding,Côte-des-Neiges - Notre-Dame-de-Grâce,TR,Transformation,Gouvernemental,Edifice gouvernemental,"DANS TOUT LE BÂTIMENT, REMPLACER LES TROIS ASCENSEURS.",0,-73.63603915711577,45.47618939630777,294164.03,5037371.58,0.057308756
373700,3003238834,3001576393,2023-01-10,2023-01-12,6700  chemin de la Côte-des-Neiges,Côte-des-Neiges - Notre-Dame-de-Grâce,TR,Transformation,Commercial,Commercial,"Sur tous les étages, Réaménagement des étages, agrandissement de l'ascenseur et rajout d'escaliers mécaniques. Travaux de structure. Aucuns travaux extérieurs",0,-73.63817055704808,45.50196638221188,294002.31,5040236.47,0.057308756
530886,1000642090,1000109191,1990-11-19,1991-03-25,3601  rue Saint-Jacques,Le Sud-Ouest,TR,Transformation,Industriel,Mixte,AMENAGEMENT CIE REPARATION D'ASCENSEURS AVEC ENTREPOSAGE ET BUREAUX PTIE R.C. AUCUNE MODIFICATION A LA STRUCTU RE,0,-73.58300521554028,45.4811755066203,298310.96,5037920.04,0.057308756
286329,3001414026,3000759574,2018-04-05,2019-01-31,5300  rue Saint-Dominique,Le Plateau-Mont-Royal,TR,Agrandissement,Gouvernemental,Edifice gouvernemental,"Angle Maguire et St-Dominique, agrandir bâtiment sur 1 étage de 8.6m² pour nouveau vestibule d'entrée +transformer bâtiment en salle de spectacle avec réaménagement +installation ascenseur et travaux de structure. Façade Maguire, installer un oculus dans l'ouverture exist. Facade St-Dominique, condamner l'entrée et remplacer par section vitrée.",0,-73.5956336094465,45.5251210295241,297329.53,5042804.82,0.057308756
474128,1000283001,1000201401,2001-02-21,2001-02-26,1420  rue Sainte-Catherine Ouest,Ville-Marie,TR,Transformation,Commercial,Edifice à bureau,"AJOUTER DES TETES D EXTINCTEURS AUTO.. A EAU AU 1 ET 2 SS,2E,3E,4E ETAGEOBTURER LES OUVERTURES DE L ANCIEN ASCENSEUR(PORTE)AU RC,2E,3E,4E ETAGE.",0,-73.57640241726307,45.49647943011179,298828.76,5039620.26,0.057308756
497050,1002350399,1000371600,1999-11-26,2000-04-20,800  boulevard De Maisonneuve Est,Ville-Marie,TR,Transformation,Commercial,Mixte,DANS L'ATRIUM INSTALLER 2 NOUVEAUX ASCENSEURS VITRES POUR TOUS LES      NIVEAUX. REFECTION DES LANTERNEAUX.,0,-73.56033364873338,45.51616458707589,300086.26,5041806.81,0.057308756
487236,1001883103,1000672803,2003-12-16,2003-12-16,700  boulevard René-Lévesque Ouest,Ville-Marie,TR,Transformation,Commercial,Commercial,AU 4E ETAGE RENOVATION DU CORRIDOR ET DU HALL D ASCENSEUR.,0,-73.56747876470557,45.50166433159323,299526.67,5040195.83,0.057308756
114206,3000499733,3000238258,2012-02-28,2012-05-25,5185  avenue du Parc,Le Plateau-Mont-Royal,TR,Transformation combinée,Commercial,Commercial,"COTE FAIRMOUNT, SUR TOITURE NIVEAU 2E, AGRANDIR BATIMENT DE + OU - 38M2. TRANSFORMER 2 COMMERCES EN 1:REMENAGER S.S., RC ET 2E. AJOUT 1 ASCENSEUR ET CAGE D'ESCALIER. AJOUT 2 APPAREILS DE MECANIQUE AU TOIT. REMPLACER TOUTES PORTES SUR RUES DANS OUVERTURES EXISTANTES. ENLEVER ESC.D'ISSUES DS RUELLE.",-1,-73.5973174734353,45.520582459024936,297197.39,5042300.61,0.057308756
487727,1001345395,1000787995,1995-10-17,1995-11-15,4244  boulevard Saint-Laurent,Le Plateau-Mont-Royal,TR,Transformation combinée,Commercial,Commercial,AJOUT D'UN ASCENSEUR ET REAMENAGEMENT INTERIEUR DES SUITES AU NIVEAU DU 2E ETAGE,0,-73.58258787916081,45.51841648873587,298347.84,5042058.61,0.057308756
487926,1000953898,1000719198,1998-06-08,1998-09-14,1  avenue du Casino,Ville-Marie,TR,Transformation,Gouvernemental,Edifice gouvernemental,CLIMATISATION DES SALLES DE MECANIQUE-ASCENSEURS/PHASE 2,0,-73.52606714274864,45.507391012823405,302763.11,5040830.36,0.057308756
453944,1001767700,1001174500,2000-09-05,2000-11-09,1981  avenue McGill College,Ville-Marie,TR,Transformation,Commercial,Commercial,AU 4 ETAGE REAMENAGER LE HALL DES ASCENSEUR SANS MODIFICATION A LA STRUCTURE,0,-73.57323921716338,45.50303499926311,299076.64,5040348.55,0.057308756
472935,1000465589,1000185990,1989-08-02,1990-05-15,1445  rue Lambert-Closse,Ville-Marie,TR,Transformation,Commercial,Commercial,"AGRAND DES 2E ET 3E ETAGES, REAMENAGER TOUS LES ETAGES, MODIFIER FACADES REFAIRE PLANCHERS DE BETON, ESCALIERS, NOU VEL ASCENSEUR, TEL QUE PLANS",0,-73.58455841499489,45.49069561549065,298190.65,5038978.14,0.057308756
473041,1000238191,1000639091,1991-05-07,1991-12-19,150  rue Saint-Paul Ouest,Ville-Marie,TR,Transformation,Gouvernemental,Edifice gouvernemental,"REAMENA. S.S.,R.C. ET 2E ETAGE+AJOUT. LUCARNE DE VENTI.,ASCENSEUR,ISSUE AU R.C.(COTE E)+TRAV.SOUS OEUVRE POUR CONS T. FUTUR D'UNE CRYPTE,T.Q.P.",0,-73.55486230042514,45.503517435622584,300512.76,5040401.02,0.057308756
487673,1001137599,1000652899,1999-06-04,1999-07-08,1600  avenue McGill College,Ville-Marie,TR,Transformation,Commercial,Edifice à bureau,"AU 20E ETAGE, REAMENAGER HALL ASCENSEURS ET CORRIDOR COMMUN ET AMENAGER BUREAUX DE ""AXA-RE"".AUCUNS TRAVAUX DE STRUCTURE NI MODIF. EXTERIEURES",0,-73.57142652743389,45.50204686881783,299218.2,5040238.61,0.057308756
227887,3001291067,3000654270,2017-03-20,2017-07-07,2450  boulevard Édouard-Montpetit,Côte-des-Neiges - Notre-Dame-de-Grâce,TR,Transformation,Institutionnels,Université,"AU PAVILLON ROGER-GAUDRY, AMÉNAGER UN TUNNEL SOUS-TERRAIN RELIANT L'ESCALIER MÉCANIQUE AU PAVILLON, INSTALLER UN ASCENSEUR RELIANT LE SOUS-SOL ET LE 1e ÉTAGE ET RÉAMÉNAGER LES ESPACES. VOIR P#3000543616-16 POUR LES TRAVAUX EN SURFACE.",0,-73.61383235062145,45.504875342380636,295904.74,5040556.76,0.057308756
483002,1000350402,1000352302,2002-03-26,2002-08-07,415  rue Saint-Antoine Ouest,Ville-Marie,TR,Transformation,Commercial,Edifice à bureau,AU RC ET 2E AMENAGER UNE GARDERIE. AU TOIT AMENAGER TERRASSE POUR LA GARDERIE ET AJOUTER UN APPENTIS. AJOUTER UN ASCENSEUR DU RC AU TOIT.,0,-73.56102699587453,45.50246151928093,300030.93,5040284.02,0.057308756
457212,1002158999,1000229400,1999-10-26,2000-03-15,955  rue de Bellechasse,Rosemont - La Petite-Patrie,TR,Transformation,Commercial,Commercial,"SUR LES 3 ETAGES, INSTALLER UN ASCENSEUR A L'INTERIEUR DU TEMPLE",0,-73.59909767682045,45.535605015056845,297060.37,5043970.25,0.057308756
403474,3001615159,3000862681,2019-07-18,2019-08-29,5505  chemin de la Côte-Saint-Luc,Côte-des-Neiges - Notre-Dame-de-Grâce,TR,Transformation,Commercial,Mixte,"Au rez-de-chaussée et au 1er sous-sol, aménager la suite commerciale prévue pour une épicerie au permis de construction du bâtiment no.3000672215-17.  Au 1er sous-sol, éliminer 2 unités de stationnement automobiles (nos 1 et 2) pour l'ajout de stationnement vélos, éliminer l'unité de stationnement 55 et réaménager ce secteur (vestibule d'ascenseur).  Pas de travaux extérieurs.",0,,,,,0.057308756
463029,1000166791,1000134591,1991-04-09,1991-04-09,6360  avenue Papineau,Rosemont - La Petite-Patrie,TR,Transformation,Commercial,Commercial,"RENOUVELER PERMIS 5728-90; INSTALLER ASCENSEUR DU S-S AU 3E, REAMENAGE- MENT ET ADDITION DE 2 CHAMBRES AU SOUS-SOL , TEL QUE PLANS.",0,-73.595301743455,45.542532375112266,297357.75,5044739.73,0.057308756
123935,3000487547,3000221943,2012-01-10,2012-01-31,1100  rue Notre-Dame Ouest,Le Sud-Ouest,TR,Transformation,Commercial,Mixte,"Dans l'atrium du secteur 4 (secteur agrandi), construire 2 nouveaux ascenseurs entre le rez-de-chaussée et le 4e étage,  sans appenti au toit",0,-73.56253350588668,45.49450544427221,299912.52,5039399.95,0.057308756
501309,1001530498,1000809998,1998-09-04,1998-10-13,1500  avenue McGill College,Ville-Marie,TR,Transformation,Commercial,Mixte,"INSTALLER ESCALIER MOBILE, ESCALIER ARCHITECTURALE ET ASCENSEUR ENTRE LER.C ET 2E, TRAVAUX PREPARATOIRE POUR ""INDIGO"", M.STRUCT. V. 15249-98",0,-73.57119128184134,45.501935087409464,299236.57,5040226.17,0.057308756
272470,3001673081,3000895134,2019-10-21,2019-11-04,2707  avenue Dollard,LaSalle,TR,AI - Aménagement intérieur,Industriel,industrie légère (i1),RÉAMÉNAGEMENT INTÉRIEUR DE CASIERS D'ENTREPOSAGE ET AJOUT D'UN ASCENSEUR,0,-73.64262876080714,45.43947137143498,293641.59,5033292.02,0.057308756
482448,1002002796,1001010696,1996-11-06,1996-11-20,1153  rue Metcalfe,Ville-Marie,TR,Transformation,Commercial,Edifice à bureau,"AU 14E ETAGE, REAMENAGEMENT PARTIEL POUR FUTURES SUITES DE BUREAUX      CORRIDORS COMMUNS PRES DES ASCENSEURS",0,-73.56987348442291,45.49957895069292,299339.33,5039964.24,0.057308756
469895,1000114792,1000381692,1992-03-23,1992-08-24,450  rue Sainte-Catherine Ouest,Ville-Marie,TR,Transformation,Commercial,Commercial,MODIFICATION AUX PUITS D'ASCENSEURS A TOUS LES NIVEAUX: CLOISONNEMENTS  CABINES APENTIS.,0,-73.56779695779382,45.50530819849644,299502.15,5040600.8,0.057308756
472437,1000453492,1000490092,1992-10-08,1992-10-22,500  place d' Armes,Ville-Marie,TR,Transformation,Commercial,Edifice à bureau,CLOISON COUPE-FEU ENTRE_LES ASCENSEURS_#8 & 9 A TOUS LES ETAGES         SANS MODIFICATION A LA STRUCTURE,0,-73.55711310265094,45.504450754212016,300336.95,5040504.86,0.057308756
256809,3001327519,3000657829,2017-08-03,2017-08-03,99999  rue Ile Sainte-Hélène,Ville-Marie,TR,Travaux intérieurs,Gouvernemental,Dépendance,"Pour la station de métro Jean-Drapeau, ajout de deux cages d'ascenseurs tels qu'aux plans approuvés.",0,-73.53407785629123,45.514112667915704,302137.47,5041577.57,0.057308756
58396,3000156763,3000057175,2009-09-08,2009-10-15,3981  boulevard Saint-Laurent,Le Plateau-Mont-Royal,TR,Transformation combinée,Commercial,Commercial,"EN FAÇADE REPEINDRE LES FINIS DE PLAFOND DANS L'ALCOVE D'ENTRÉE, AU REZ-DE-CHAUSSÉE RÉAMÉNAGER LE HALL D'ENTRÉE ET LE HALL D'ASCENSEUR.",0,-73.57838226789055,45.51686246780275,298676.24,5041885.58,0.057308756
493644,1001569600,1001095800,2000-08-02,2000-10-16,275  rue Notre-Dame Est,Ville-Marie,TR,Transformation,Gouvernemental,Edifice gouvernemental,REFECTION DES ASCENSEURS DE L'HOTEL DE VILLE,0,-73.5538957309044,45.508406658355085,300588.66,5040944.31,0.057308756
76287,3000177670,3000062453,2010-02-02,2010-02-02,610  rue Saint-Jacques,Ville-Marie,TR,Transformation,Commercial,Edifice à bureau,"Niveau Mezzanine, réaménagement du hall des ascenseurs, tel que plans approuvés.  Aucun travaux extérieurs.",0,-73.560197265708,45.50080489380447,300095.64,5040099.87,0.057308756
268991,3001418285,3000736959,2018-04-24,2018-09-07,6200  rue Drake,Le Sud-Ouest,TR,Transformation,Équi.Colle. et Institutionnels,Edifice gouvernemental,"Agrandissement de l'édicule du métro pour l'installation d'ascenseur ""Métro jolicoeur"".",0,,,,,0.057308756
470034,1000106595,1000155095,1995-01-30,1995-03-20,1010  rue De La Gauchetière Ouest,Ville-Marie,TR,Transformation,Commercial,Edifice à bureau,AJOUT D'UN ESCALIER DANS CHAMBRE ELECTRIQUE DU R DE C ENTREE ST ANTOINE.- ACCES A L'ASCENSEUR POMPIER -,0,-73.56726471501632,45.4980994798593,299543.07,5039799.65,0.057308756
211686,3001125877,3000547459,2016-03-30,2016-06-09,3737  boulevard Thimens,Saint-Laurent,TR,AG AGRANDISSEMENT INT / EXT,INDUSTRIE,I3 Manufacturière,AGRANDISSEMENT LATERAL - AJOUT D'UN ASCENSEUR «EMBALLAGES MITCHEL-LINCOLN»,0,-73.71492265414889,45.49721807134922,288002.91,5039721.97,0.057308756
472833,1000325290,1000374590,1990-06-20,1990-08-27,1415  rue Saint-Hubert,Ville-Marie,TR,Transformation,Commercial,Commercial,"REAMENAGEMENT DES SALLES DE CONFERENCES, TOILETTES ET HALL D'ASCENSEURS DES 5E ET 6E ETAGES, MECANIQUE, TERRASSE S UR TOIT, TEL QUE PLANS.",0,-73.55907255545934,45.515526241874305,300184.73,5041735.8,0.057308756
503445,1003032794,1000649694,1994-09-01,1994-10-11,4255  avenue Papineau,Le Plateau-Mont-Royal,TR,Transformation combinée,Gouvernemental,Centre hospitalier,"MISE AUX NORMES DU REGLEMENT #9510 ARTICLE 10.2/ GICLEURS, SAS POUR     ASCENSEUR,PRESSURISATION ESCALIER (SS)",0,-73.57020770837217,45.53088452860523,299316.25,5043443.28,0.057308756
437569,3003602579,3001889533,2025-10-03,2025-10-23,5060  boulevard des Sources,Pierrefonds - Roxboro,CO,TF- Transformation,public et institutionnel,institutions,"TRAVAUX DE MISE AUX NORMES ET DE MAINTIEN D'ACTIFS À L'ÉCOLE SECONDAIRE DE L'ALTITUDE : INSTALLATION DE GICLEURS, MISE AUX NORMES DU SYSTÈME D'ALARME INCENDIE, AJUSTEMENTS AUX PORTES ET CORRIDORS COUPE-FEU, REMPLACEMENT DE L'ASCENSEUR, TRAVAUX DANS LES BLOCS SANITAIRES . TEL QUE LES PLANS APPROUVÉS.",0,-73.8243948234744,45.50961520692309,279452.78,5041128.39,0.057308756
460920,1000302899,1000153999,1999-02-12,1999-02-12,303  rue Notre-Dame Est,Ville-Marie,TR,Transformation,Commercial,Edifice à bureau,"AU 2E SS, AMENAGER 2 SALLES DE TOILETTES ADJACENTES AU PUITS D'ASCENSEUR.",0,-73.55327694463111,45.509185934227276,300637.07,5041030.88,0.057308756
532371,1000616193,1000177094,1993-11-15,1994-04-19,4625  avenue De Lorimier,Le Plateau-Mont-Royal,TR,Transformation combinée,Gouvernemental,Centre hospitalier,"INSTAL. D'UN SYSTEME D'ALARME INCENDIE, D'UN SYSTEME DE COMMUNICATION,  D'UN ASCENSEUR ET D'UNE CHUTE A LINGE , REAMEN. DE LA RECEPT./EXPED.",0,-73.5742101323795,45.53599042625165,299004.16,5044010.98,0.057308756
38122,3000115853,3000036647,2008-08-26,2008-08-26,7650  boulevard Maurice-Duplessis,Rivière-des-Prairies - Pointe-aux-Trembles,TR,Transformation,Gouvernemental,Edifice gouvernemental,AMÉNAGEMENT DU 2E ETAGE ET AJOUT D'UN ASCENSEUR.,0,-73.59448830777825,45.626779622423726,297432.31,5054102.23,0.057308756
27700,3000078585,3000031287,2007-07-31,2008-04-02,3095  rue Sherbrooke Est,Rosemont - La Petite-Patrie,TR,Transformation,Gouvernemental,Centre hospitalier,AGRANDIR BÂTIMENT DE L'AILE ADMINISTRATIVE SUR 4E ÉTAGES + APPENTI AU TOIT POUR ESCALIER ET CAGE D'ASCENSEUR TEL QUE PLANS,0,-73.55912004273544,45.542844078378145,300183.26,5044771.66,0.057308756
452329,1000828297,1000446697,1997-06-04,1997-07-03,1690  rue Atateken,Ville-Marie,TR,Transformation,Commercial,Commercial,"SUITE A AVIS DU SPIM, INSTALLER UN DISPOSITIF D'OUVERTURE DE PORTE AU S-SOL,ENTRE ESCALIER #3 ET ASCENSEUR #1 (SUR SERRURE ÉLECTOMAGNÉTIQUE).",0,-73.56023396962124,45.51891182895779,300094.28,5042112.11,0.057308756
512097,1000009793,1000055493,1993-01-13,1993-02-26,3570  rue Saint-Urbain,Le Plateau-Mont-Royal,TR,Transformation combinée,Gouvernemental,Centre hospitalier,MODIFICATION AU SYSTEME DE VENTILATION POUR LA CAGE D'ASCENSEUR ET DEPLACEMENT DE LA FOSSE DE PLOMBERIE AU SS.,0,-73.57280580638958,45.51231217452008,299111.45,5041379.5,0.057308756
451612,1002828994,1000654194,1994-07-27,1994-10-12,1057  rue Berri,Ville-Marie,TR,Transformation,Commercial,Mixte,"REAMENAGEMENT COMPLET DE 3 BATIMENTS EN UN BATIMENT, INSTALLATION DE    GICLEURS, ASCENSEURS",0,-73.55661979631329,45.51325335159103,300376.19,5041483.07,0.057308756
470112,1000971895,1000623895,1995-08-03,1995-09-29,6250  chemin de la Côte-des-Neiges,Côte-des-Neiges - Notre-Dame-de-Grâce,TR,Transformation,Commercial,Commercial,NOUVEL ASCENSEUR POUR TOUT LA BATISSE DE BELL CANADA,0,-73.63317363140959,45.50130429533327,294392.69,5040162.23,0.057308756
155220,3000715651,3000345468,2013-08-27,2013-09-26,700  rue Saint-Antoine Est,Ville-Marie,TR,Transformation,Commercial,Edifice à bureau,"Dans ancienne gare Viger, du SS au 5e étage, remplacer et remettre aux normes les ascenseurs, cloisonner les escaliers d'issues, aménager les étages en «base building» de bureaux pour futurs occupants et, au 2e étage, aménager en bureau pour la cie Jesta, tel que plans approuvés. Aucuns travaux ext.",0,,,,,0.057308756
184549,3001042828,3000508321,2015-08-07,2015-10-05,2450  boulevard Édouard-Montpetit,Côte-des-Neiges - Notre-Dame-de-Grâce,TR,Transformation,Institutionnels,Université,"PROJET # 10052418 - AU PAVILLON ROGER-GAUDRY, REFECTION DES ASCENSEURS 1 ET 2.",0,-73.61383235062145,45.504875342380636,295904.74,5040556.76,0.057308756
553194,1002202401,1001163901,2001-11-27,2001-11-28,7070  boulevard Perras,Rivière-des-Prairies - Pointe-aux-Trembles,TR,Transformation,Gouvernemental,Centre hospitalier,REAMENAGER LE HALL D'ENTREE/RECEPTION. RELOCALISER LES PANNEAUX ANNONCIATEUR D'ALARME-INCENDIE & ASCENSEUR. AUCUNE MODIFICATION AUX CLOISONS.,0,-73.61581720215608,45.626666217592465,295769.17,5054091.81,0.057308756
7346,3000008604,3000005813,2005-04-07,2005-07-07,800  rue De La Gauchetière Ouest,Ville-Marie,TR,Transformation,Commercial,Commercial,"AU 8E ÉTAGE, AJOUT D'UN ASCENSEUR DANS LA PARTIE DU PORTAIL SUD-EST ET AJOUT D'UN APENTIS AU TOIT..",0,,,,,0.057308756
350190,3003182593,3001542253,2022-06-06,2022-07-29,7151  rue D'Iberville,Villeray - Saint-Michel - Parc-Extension,TR,Transformation,Gouvernemental,Edifice gouvernemental,"EN LIEN AVEC LE PERMIS 3000966033-20, APPORTER DES MODIFICATIONS MINEURES AUX TRAVAUX PRÉVUS À LA STATION DE MÉTRO IBERVILLE: VISANT L'AJOUT D'ASCENSEUR ET D'UN ÉTAGE POUR ÉQUIPEMENTS MÉCANIQUES.",0,-73.60305695556359,45.551237052423865,296753.38,5045707.85,0.057308756
370479,3003179215,3001528435,2022-05-26,2022-05-31,455  boulevard René-Lévesque Ouest,Ville-Marie,TR,Travaux intérieurs,Commercial,Edifice à bureau,"Au rez-de-chaussée et au 2e étage, aménager une salle d'entrainement pour « SNC Lavalin » et au 2e étage, aménager une salle courrier. Du sous-sol 1 au rez-de-chaussée, enlever un ascenseur. Au 15e et 16e étage, réaménager les suites 1500 et 1600 des bureaux de « SNC Lavalin ». Travaux tels qu'aux plans approuvés.",0,-73.56567459781994,45.50500608731649,299667.97,5040567.09,0.057308756
388519,3003380656,3001706154,2024-04-25,2024-05-09,4375  rue Ontario Est,Mercier - Hochelaga-Maisonneuve,TR,Transformation,Propriété public,Bâtiment municipal,"Réaménagement intérieur, nouvelles cloisons intérieures et des finis de plancher, réfection de l'escalier intérieur, mise aux normes de l'ascenseur, modernisation plomberie, électrictité et ventilation",0,-73.54012173732045,45.55384868048512,301667.47,5045993.7,0.057308756
428846,3003473609,3001820680,2024-10-22,2025-04-04,2653  rue Masson,Rosemont - La Petite-Patrie,TR,PA-Transfo.PIIA sans agrand.,Commercial,Commercial,"En cour latérale, agrandir le bâtiment principal pour nouvelle cage d'ascenseur. Avec travaux de structure. Tel que documents approuvés",0,-73.57642128450217,45.54610040402113,298832.53,5045134.68,0.057308756
267360,3001469746,3000964733,2018-10-25,2020-03-16,1400  avenue Van Horne,Outremont,TR,Transformation,Institutionnel,Édifice gouvernemental,"AJOUT D'UN PUITS DE VENTILATION AU TOIT DE LA STATION DE MÉTRO OUTREMONT,  AJOUT DE TROIS PUITS D'ASCENSEURS ET  DE TROIS LANTERNEAUX EN COUR LATÉRALE POUR NOUVEL ESCALIER EN SOUTERRAIN. TEL QUE DOCUMENTS DÉPOSÉS ET RÉSOLUTION CA20 16 0087.",0,,,,,0.057308756
228754,3001275948,3000629435,2017-01-16,2017-01-31,4465  boulevard des Sources,Pierrefonds - Roxboro,CO,TF- Transformation,commercial,type détails et services,AJOUT D'UN ASCENSEUR - MÉDI CENTRE,0,-73.81087518757253,45.49796858727231,280504.16,5039829.92,0.057308756
79531,3000159386,3000057448,2009-09-15,2009-10-20,2205  boulevard de la Côte-Vertu,Saint-Laurent,CA,MI Modifications Intérieures,COMMERCE DE DÉTAIL,C1 Léger,MODIFICATIONS INTÉRIEURES = AJOUT D'UN ASCENSEUR,0,-73.69255644493255,45.506826790277046,289753.49,5040785.36,0.057308756
286782,3001442750,3000729016,2018-07-06,2018-07-06,900  rue Guy,Ville-Marie,TR,Travaux intérieurs,Commercial,Edifice à bureau,"Aux 16e et 17e étages, réaménager les étages pour les bureaux de «WSP» et réaménager partiellement les halls d'ascenseurs et les WC, tels qu'aux plans approuvés.",0,-73.57430229951952,45.49286083131111,298992.52,5039217.97,0.057308756
