_id,no_demande,id_permis,date_debut,date_emission,emplacement,arrondissement,code_type_base_demande,description_type_demande,description_type_batiment,description_categorie_batiment,nature_travaux,nb_logements,longitude,latitude,loc_x,loc_y,rank
322991,3002418994,3001274053,2020-10-22,2021-02-23,4710  rue Saint-Ambroise,Le Sud-Ouest,TR,Transformation,Industriel,Mixte,"Au premier étage du côté stationnement, ajouter une rampe d'accès universel. Agrandir l'ouverture d'une fenêtre pour y installer de la nouvelle fenestration et une porte. Remplacer la marquise. Remplacer les escaliers. Installer deux persiennes pour entrée et sortie d'air dans les mêmes ouvertures que deux fenêtres existantes sous la rampe.",0,-73.58538080297238,45.47013987289,298123.94,5036693.84,0.0706241
116974,3000528375,3000332771,2012-06-04,2013-05-23,3737  rue Sherbrooke Est,Rosemont - La Petite-Patrie,TR,Transformation,Gouvernemental,Edifice gouvernemental,"FACE SHERBROOKE:ENLEVER RAMPE ACCÈS POUR PERSONNE À MOBILITÉ RÉDUITE,RAGRÉER MARCHE & PERRON, REMPL.MUR RIDEAU D'ENTRÉE. ARR:AMÉN.RAMPE D'ACCÈS & DÉBARCADÈRE POUR PERSONNES À MOBILITÉ RÉDUITE.RC:RÉAMÉN.TOILETTE & AMÉN.1 SALLE DE TOILETTE HANDICAPÉ. 5E ÉTAGE: RÉAMÉN. L'ACCESSIBILITÉ, TEL QUE PLANS.",0,-73.55632574074443,45.550054513115334,300402.03,5045572.81,0.0706241
398924,3003383118,3001710595,2024-04-30,2024-05-21,7741  avenue du Ronceray,Anjou,TR,Transformation,Public,Édifice public,"En avant sur ur Avenue du Ronceray : Remplacer la rampe d'accès et le trottoir privé existants en béton par une nouvelle rampe et un nouveau trottoir privé en béton avec un garde-corps en métal, conformément aux plans approuvés.",0,-73.56091844931095,45.606514740515536,300048.19,5051847.6,0.0706241
422530,3003556957,3001874291,2025-06-17,2025-09-11,6595  avenue Somerled,Côte-des-Neiges - Notre-Dame-de-Grâce,TR,Transformation,Commercial,Commercial,"En cour avant, devant l'entrée principale, remplacer la rampe d'accès universelle. Remplacer les mains courantes de chaque côté de la rampe.",0,-73.6392953356879,45.46696614764549,293907.67,5036347.04,0.0706241
249713,3001323942,3000656722,2017-07-19,2017-07-27,323  rue Chabanel Ouest,Ahuntsic - Cartierville,TR,Transformation,Industriel,Industriel,"Rez-de-chaussée, aménager 2 suites pour le centre de distribution de Poste Canada. (1 suite accessible par le 333 et 1 suite accessible par le 353) Mur latéral gauche ajouter 2 persiennes et 1 rampe d'accès, mur arrière ajouter 1 porte et 1 rampe d'accès, mur latéral droit ajouter 1 persienne. Sur toutes les fenêtres des 2 suites ajouter un film de protection transparent.",0,-73.65518795843988,45.54005204850045,292680.62,5044471.39,0.0706241
228369,3001292231,3000677415,2017-03-23,2017-11-09,4255  avenue Papineau,Le Plateau-Mont-Royal,TR,Transformation combinée,Gouvernemental,Centre hospitalier,"Dans l'appentis au toit, retirer génératrice et ses grilles de ventilation et obturer ces ouvertures avec revêtement métallique, réaménagement intérieur mineur. Rampe d'accès extérieur à l'arrière pour SS: creuser et niveler partie de rampe pour installer nouvelle génératrice encloisonnée sur nouveau caillebotis.",0,-73.56992648215767,45.531262164132535,299338.25,5043485.22,0.0706241
17916,3000049269,3000016919,2006-08-15,2006-09-20,6640  avenue Somerled,Côte-des-Neiges - Notre-Dame-de-Grâce,TR,Transformation,Commercial,Mixte,"EN FAÇADE AVANT,  REFAIRE LA RAMPE POUR ACCÈS HANDICAPÉS (NOUVELLES DIMENSIONS) CONSTRUIRE UNE RAMPE CÔTÉ WALKLAY",0,-73.63920744944922,45.466145847989964,293914.39,5036255.87,0.0706241
481228,1000699593,1000161494,1993-12-29,1994-04-12,7255  rue Sherbrooke Est,Mercier - Hochelaga-Maisonneuve,TR,Transformation,Commercial,Commercial,CONSTRUCTION D'UNE RAMPE D'ACCES (RAMPE D'HANDICAPE DEJA EXISTANTE),0,-73.53895085523457,45.59005903533249,301760.84,5050017.78,0.0706241
121790,3000520371,3000287483,2012-04-25,2012-09-22,5115  rue Rivard,Le Plateau-Mont-Royal,TR,Transformation combinée,Gouvernemental,Edifice gouvernemental,"EN COUR LATÉRALE SUD, DÉMOLIR LA RAMPE D'ACCÈS EXISTANTE. EN FAÇADE, PARALLÈLEMENT À LA RUE RIVARD, ABATTRE UN ARBRE ET RELOCALISER LA RAMPE D'ACCÈS. AU MUR LATÉRAL SUD ET À LA COLONNE DU PORTIQUE D'ENTRÉE, RÉFECTION PONCTUELLE DE LA BRIQUE À L'IDENTIQUE. CA 12 25 0210 ET CA 12 25 0213.",0,-73.58926722655472,45.527901791126844,297827.19,5043113.28,0.0706241
251091,3001331332,3000675774,2017-08-17,2017-11-03,2583  boulevard Pie-IX,Mercier - Hochelaga-Maisonneuve,TR,Transformation,Gouvernemental,Edifice du culte,"EN FAÇADE (AVENUE DESJARDINS), AJOUTER UNE RAMPE ET UNE ENTRÉE ACCESSIBLE AUX PERSONNES À MOBILITÉ RÉDUITE. AU SOUS-SOL, AJOUTER DEUX RAMPES, UNE TOILETTE UNIVERSELLE ET AMÉNAGER L'INTÉRIEUR. AJOUTER LE NUMÉRO MUNICIPAL: 2502 AVENUE DESJARDINS.",0,-73.54877083620876,45.55320707527238,300992.14,5045922.77,0.0706241
101400,3000420282,3000190002,2011-06-22,2011-07-18,8000  rue De Normanville,Villeray - Saint-Michel - Parc-Extension,TR,Transformation,Gouvernemental,Edifice gouvernemental,En façade sur de Normanville remplacement de l'escalier principale et installation d'une nouvelle rampe pour l'accès aux handicapés.sur le coté latéral droit aménagement de rampe et déafféctation du trottoir pour accès des handicapés à partir du stationnement.À l'intérieur élargir les portes....etc.,0,-73.62129085635962,45.54761126803562,295329.08,5045306.9,0.0706241
228505,3001280588,3000642947,2017-02-01,2017-04-18,8455  avenue Papineau,Villeray - Saint-Michel - Parc-Extension,TR,Transformation,Commercial,Edifice à bureau,"AU RDC, MODIFICATION ET RELOCALISATION DE LA RAMPE POUR HANDICAPÉE ET DE L'ESCALIER EXTÉRIEUR. MODIFICATION MINEURE À L'AIRE DE STATIONNEMENT À L'EMPLACEMENT DE L'ANCIENNE RAMPE.",0,-73.62543517148296,45.55668416348921,295007.05,5046315.68,0.0706241
186621,3001024097,3000485204,2015-06-25,2015-07-08,7141  rue Sherbrooke Ouest,Côte-des-Neiges - Notre-Dame-de-Grâce,TR,Transformation,Institutionnels,Université,"AU PAVILLON SC, DÉOMLIR LA RAMPE D'ACCÈS ET L'ESCALIER, CONSTUCTION D'UNE NOUVELLE RAMPE D'ACCÈS ET D'UN NOUVEL ESCALIER, REMPLACER LES PORTES D'ENTRÉE ET RÉPARATION AU PALIER.",0,-73.64068676763283,45.45857996905534,293797.24,5035415.28,0.0706241
376745,3003451044,3001773353,2024-09-06,2024-10-04,6705  rue Saint-Jacques,Côte-des-Neiges - Notre-Dame-de-Grâce,TR,Transformation,Commercial,Commercial,"Au 6705, réaménager le local 1 avec ajout du numéro civique 6707. Sur la façade avant, démolir la rampe d'acces au quai de chargement, remplacer une fenêtre pleine hauteur par une porte et construire une rampe pour personne à mobilité reduite.",0,-73.62760875114309,45.45915163483361,294820.14,5035477.1,0.0706241
43340,3000122734,3000109644,2008-11-05,2010-12-16,9600  rue Saint-Denis,Ahuntsic - Cartierville,TR,Transformation,Gouvernemental,Edifice gouvernemental,DÉMANTELER  RAMPE D'ACCÈS EXISTANTE ET CONSTRUIRE UNE NOUVELLE RAMPE DU CÔTÉ LATÉRAL GAUCHE DU BÂTIMENT,0,-73.65406034426204,45.54854172849721,292770.5,5045414.69,0.0706241
243037,3001338597,3000807756,2017-09-15,2019-05-09,1153  rue Metcalfe,Ville-Marie,TR,Travaux extérieurs,Commercial,Edifice à bureau,"En façade rue Metcalfe, remplacer la rampe d'accès par une nouvelle rampe d'accès remise aux normes.  Tel que plans approuvés.",0,-73.57020555361909,45.50018793653267,299313.44,5040031.94,0.0706241
109680,3000260523,3000165283,2010-11-30,2011-06-06,3500  boulevard Décarie,Côte-des-Neiges - Notre-Dame-de-Grâce,TR,Transformation,Gouvernemental,Centre hospitalier,Refaire la rampe d'accès du côté du boulevard décarie et refaire la rampe d'accès du côté de la rue Prud'homme.,0,-73.6118657227236,45.475201273925286,296053.83,5037258.86,0.0706241
37095,3000090151,3000029762,2007-11-19,2008-01-10,687  avenue des Pins Ouest,Ville-Marie,TR,Transformation,Gouvernemental,Centre hospitalier,"Au niveau sous-sol, sous la rampe d'accès, aménager un nouveau tunnel ( 2,44m de large X 2m de haut ) entre les pavillons ""E"" et ""S"".  Face à la rue University, entrée qui donne dans le pavillon ""S"", remplacer l'aménagement extérieur, les rampes d'accès, le mur de soutènement, la marquise.",0,-73.58252609938798,45.50796323270566,298351.47,5040896.93,0.0706241
33323,1300725580,1300725508,2007-02-05,2007-02-06,7401  rue Churchill,Verdun,CO,Construction,Commerce,Centre commercial,RÉNOVATION INTÉRIEURE ET MISE-AUX-NORMES DU BÂTIMENT POUR RÉSEIDENCE SUPERVISÉE. CONSTRUCTION D'UNE RAMPE POUR PERSONNE À MOBILITÉ RÉDUITE. (PLAN DE LA RAMPE À VENIR) LA CONFORMITÉ DES TRAVAUX ET LE S,0,,,,,0.0706241
275535,3001669589,3001006013,2019-10-15,2020-06-01,3585  rue Saint-Urbain,Le Plateau-Mont-Royal,TR,T1:Transformation ext/PA/PIIA,Commercial,Commercial,"En façade sur la mansarde, remplacer certaines tuiles d'ardoise. Démolir la rampe d'accès sur coté latéral droit, excaver pour imperméabiliser la fondation et refaire rampe d'accès en pavé de béton préfabriqué, conserver main courante. À l'arrière sur une partie du mur, remplacer certaines briques et rehausser la cheminée latérale avec brique Milva de Rocky Ridge, modulaire.",0,-73.5728715034492,45.51268524928244,299106.35,5041420.96,0.0706241
496400,1002147398,1001044598,1998-12-09,1998-12-16,1750  rue Saint-André,Ville-Marie,TR,Transformation,Commercial,Commercial,"A L'EXTERIEUR DANS LA MARGE LATERAL, INSTALLER UNE RAMPE D'ACCES POUR LAGARDERIE (RAMPE POUR POUSSETTES).",0,-73.56198608675363,45.51813223455966,299957.33,5042025.57,0.0706241
401899,3003442934,3001759776,2024-08-20,2024-09-03,7741  avenue du Ronceray,Anjou,TR,Transformation,Public,Édifice public,"À la suite du permis #3001710595-24, en avant sur Avenue du Ronceray : Remplacer la rampe d'accès existante et le trottoir privé en béton par une nouvelle rampe et un nouveau trottoir privé en béton avec un garde-corps en métal, conformément aux plans approuvés.",0,-73.56091844931095,45.606514740515536,300048.19,5051847.6,0.0706241
474111,1002115299,1000991899,1999-10-20,1999-10-20,1806  rue Notre-Dame Est,Ville-Marie,TR,Transformation,Industriel,Industriel,"AU RC, SUR 72PI DE FACADE & 15PI DE PROFOND, REMPLACER LA DALLE DE BETON& LA RAMPE D'ACCES PAR UNE AUTRE DALLE DE BETON & RAMPE D'ACCES",0,-73.54704475894063,45.520377201971556,301124.77,5042274.27,0.0706241
137770,3000645002,3000311583,2012-10-18,2012-10-27,12366  rue Lachapelle,Ahuntsic - Cartierville,TR,Transformation,Commercial,Mixte,"Façade, réparer le plancher en ciment du perron, de l'escalier et de la rampe d'handicapé, remplacer le garde-corps de la rampe d'handicapé. (construction existante, aucun empiètement sur le domaine public)",0,-73.72325149993185,45.53117777076389,287362.47,5043497.71,0.0706241
367229,3003251998,3001806593,2023-02-28,2025-01-27,377  rue Sherbrooke Ouest,Le Plateau-Mont-Royal,TR,T1:Transformation ext/PA/PIIA,Commercial,Mixte,"En façade, mise en conformité de la rampe d'accès handicapé et réfection des marches en béton. Installer mains-courantes, garde-corps et bacs de plantation. Sur Hutchison, refaire rampe et escalier pour accéder à la porte de garage. Installer un drain français le long de cette façade et aménager 2 grandes plate-bandes avec plantations directes au sol. Aucuns autres travaux.",0,-73.57181666327206,45.50807723950301,299188.31,5040908.79,0.0706241
163542,3000975707,3000459735,2015-02-26,2015-04-24,1951  boulevard De Maisonneuve Est,Ville-Marie,TR,Travaux extérieurs,Commercial,Mixte,"En façade, remplacer la rampe d'accès et le garde-corps par une nouvelle rampe d'accès et nouveau garde-corps.  Tel que plans approuvés.",0,-73.55281892981745,45.52465707511114,300673.99,5042750.17,0.0706241
133012,3000703424,3000340697,2013-06-21,2013-07-19,6572  avenue du Parc,Rosemont - La Petite-Patrie,TR,Transformation,Commercial,Mixte,"FAÇADE AVENUE DU PARC PORTE D'ACCÈS DÉMOLIR PERRON, MARQUISE ET RAMPE D'ACCÈS POUR FAUTEUILS ROULANTS, CONSTRUIRE NOUVEAUX VESTUBULE, PERRON ET RAMPE D'ACCÈS TEL QUE PLANS",0,-73.61559720258026,45.52762936780498,295770.47,5043085.63,0.0706241
481611,1001668703,1000011804,2003-11-07,2004-01-13,2100  avenue Marlowe,Côte-des-Neiges - Notre-Dame-de-Grâce,TR,Transformation,Commercial,Commercial,"DANS LA COUR AVANT ENLEVER LA RAMPE POUR AMBULANCE, AJOUTER UNE RAMPE   POUR HANDICAPÉ ET RELOCALISER LA MARQUISE D'ENTRÉE.",0,-73.6065344827284,45.47477918756146,296470.59,5037211.39,0.0706241
11448,3000018932,3000006142,2005-07-18,2005-07-19,1  place Ville-Marie,Ville-Marie,TR,Transformation,Commercial,Edifice à bureau,"RUE CATHCART, RÉFECTION DE LA RAMPE D'ACCÈS EXTÉRIEURE DU STATIONNEMENT INTÉRIEUR, TEL QUE L'EXISTANT",0,-73.56899123133239,45.501600528164325,299408.47,5040188.84,0.057308756
8817,3000014403,3000005060,2005-06-14,2005-06-14,2121  rue Notre-Dame Est,Ville-Marie,TR,Transformation,Commercial,Edifice à bureau,"AU RC, RÉFECTION DES ESCALIERS  ET DE LA RAMPE D'ACCÈS EN FACADE DE L'ENTRÉE PRINCIPALE,",0,-73.54651779010396,45.523800275755264,301166.16,5042654.65,0.057308756
67194,3000128785,3000045740,2009-01-29,2009-06-10,1100  rue Fleury Est,Ahuntsic - Cartierville,TR,Transformation,Gouvernemental,Edifice du culte,"Du côté de la rue Fleury, construire une rampe d'accès pour personnes à mobilité réduite",0,-73.65814276990616,45.55852828556191,292453.91,5046525.13,0.057308756
484336,1000248692,1000252892,1992-06-02,1992-06-02,4700  avenue Prince-of-Wales,Côte-des-Neiges - Notre-Dame-de-Grâce,TR,Transformation,Commercial,Commercial,AMENAGER UNE RAMPE D'HANDICAPES POUR UNE DENIVELLATION DE 3.5 POUCES,0,-73.63883434941278,45.466629178968155,293943.65,5036309.53,0.057308756
392881,3003446059,3001762898,2024-08-23,2024-09-11,2351  boulevard Alfred-Nobel,Saint-Laurent,TR,TR Transformations Extérieures,INDUSTRIE,I1 Recherche et développement,REMPLACEMENT D'UN ESCALIER MÉTALLIQUE EXTÉRIEUR PAR UN ESCALIER EN BÉTON ET AMÉNAGEMENT D'UNE RAMPE D'ACCÈS POUR PERSONNES À MOBILITÉ RÉDUITE,0,-73.75904760973367,45.483765801581775,284549.55,5038237.19,0.057308756
12024,3000023033,3000007405,2005-08-30,2005-09-07,3500  boulevard Saint-Joseph Est,Rosemont - La Petite-Patrie,TR,Transformation,Commercial,Commercial,"EN FAÇADE DU CÔTÉ GAUCHE DANS LA COUR AVANT , INSTALLER UNE RAMPE POUR UN PARCOURS SANS OBSTACLES AU BÂTIMENT TEL QUE PLANS",0,-73.56597032549172,45.55159530033451,299649.11,5045744.61,0.057308756
179668,3001046876,3000645961,2015-08-20,2017-05-10,5353  avenue du Parc,Le Plateau-Mont-Royal,TR,Transformation combinée,Commercial,Mixte,"Suite au permis 3000351637-13, arrière, remplacer balcons du 2e et 3e par balcons en acier avec nouv. dimensions (3e), RC, remplacer rampe d'accès livraison à l'identique. Au toit (ptie arrière sur 1 étage), remplacer équip. méc. et sur mur lat. gauche, remplacer conduit de ventilation. Mur arr., ajouter porte (ptie bâtiment de 1 étage). RC, ptie arrière, ajout murs porteurs.",0,-73.60047079881828,45.521734740960795,296951.2,5042428.96,0.057308756
140785,3000538128,3000262905,2012-07-19,2012-08-17,1610  rue Fullum,Ville-Marie,TR,Transformation,Commercial,Commercial,"Sur la façade de la rue Fullum, remplacer les grilles des portes de deux entrées. Sur la façade de la rue Olivier-Robert, remplacer la grille de l'entrée et installer une rampe d'accès.  Les travaux doivent être selon les plans et échantillon approuvés.",0,-73.55106051333513,45.52786674187745,300811.58,5043106.78,0.057308756
54773,3000152892,3000057741,2009-08-17,2009-10-26,1789  rue Fleury Est,Ahuntsic - Cartierville,TR,Transformation,Commercial,Mixte,Construire une rampe d'accès en cour latérale gauche. Créer une nouvelle porte coté gauche. Remplacer la porte de façade par fenêtre. Enlever les 2 ouvertures pour dépôts de nuits. Remplacer l'escalier arrière. Remplacer les appareils de conditionnement de l'air au toit.,0,-73.65380234460824,45.568008024170716,292794.79,5047577.97,0.057308756
363386,3002146334,3001106753,2020-07-21,2020-08-31,1525  rue du Havre,Ville-Marie,TR,Travaux extérieurs,Industriel,Industriel,"En façade du bâtiment, aménager une rampe d'accès pour handicapé tels qu'aux plans approuvés.",0,-73.54697024480369,45.53228451617148,301131.36,5043597.53,0.057308756
454620,1000262492,1000350692,1992-06-10,1992-07-31,6593  rue Beaubien Est,Mercier - Hochelaga-Maisonneuve,TR,Transformation,Commercial,Commercial,"AMENAGER GUICHET AUTOMATIQUE AU NIVEAU DU REZ DE CHAUSSEE ET RAMPE      D'HANDICAPE EN FACADE AVANT, SANS MODIFICATION A LA STRUCTURE",0,-73.56066734854377,45.588337091221376,300066.25,5049827.46,0.057308756
449981,1000533290,1000517890,1990-10-03,1990-10-31,3430  rue Jeanne-Mance,Le Plateau-Mont-Royal,TR,Transformation combinée,Gouvernemental,Edifice gouvernemental,AMENAGEMENT D'UNE NOUVELLE RAMPE D'HANDICAPES ET D'UN ACCES POUR LES VEHICULES EN FACADE. AJOUT DE NOUV.PORTES U.L.C R.C. AU 10E ETAGE,0,-73.57153588826436,45.50954163515116,299210.4,5041071.51,0.057308756
457798,1001041102,1000363402,2002-08-12,2002-08-14,2235  rue Delisle,Le Sud-Ouest,TR,Transformation,Équi.Colle. et Institutionnels,Edifice gouvernemental,"AU 3E ÉTAGE, AMÉNAGER UNE PARTIE DE L'ÉTAGE EN BUREAUX POUR O.M.H.M,    NOUVEL ASCENSEUR, RAMPE POUR HANDICAPÉS, MODIFIER LA FAÇADE, FENÊTRES.",0,-73.57385277050967,45.48538769437995,299026.89,5038387.44,0.057308756
446646,3003613834,3001903942,2025-11-03,2026-01-06,3800  rue Saint-Hubert,Le Plateau-Mont-Royal,TR,T1:Transformation ext/PA/PIIA,Commercial,Mixte,"En facade avant, installer une rampe pour accessibilité universelle et un escalier. Le tout tel que plans approuvés.",0,-73.57137390340338,45.520952459460126,299224.18,5042339.6,0.057308756
77247,3000169744,3000058751,2009-11-12,2009-11-13,5900  rue De Saint-Vallier,Rosemont - La Petite-Patrie,TR,Transformation,Gouvernemental,Edifice gouvernemental,COUR SEMI-INTÉRIEUR REFAIRE RAMPE D'ACCÈS POUR PERSONNES À MOBILITÉES RÉDUITES ET AGRANDIR BALCON TEL QUE PLANS,0,-73.59981638717935,45.53221697346283,297003.77,5043593.8,0.057308756
437983,3003569808,3001854933,2025-07-24,2025-07-28,1820  avenue Clifford,Le Sud-Ouest,TR,Travaux extérieurs-intérieurs,Équi.Colle. et Institutionnels,Équi.Colle. et Institutionnels,"Réaménagement de l'aire de jeux 18 mois- 5 ans. Travaux électriques et d'aménagement du parc Clifford, travaux d'excavation, de démolition et reconstruction du trottoir en béton, drain de fondation existant, rampe d'accès et l'asphalte.",0,-73.58944317995821,45.450202370787345,297803.83,5034478.54,0.057308756
434304,3003569955,3001870961,2025-07-21,2025-09-03,8870  rue Lajeunesse,Ahuntsic - Cartierville,TR,Transformation,Commercial,Commercial,"En cour latérale droite jusqu'en cour avant, démolir et remplacer la rampe d'accès pour personnes à mobilité réduite.",0,-73.64147551610661,45.54722940270031,293752.9,5045267.04,0.057308756
384119,3003271124,3001609595,2023-04-21,2023-06-09,7070  boulevard Perras,Rivière-des-Prairies - Pointe-aux-Trembles,TR,Transformation,Gouvernemental,Centre hospitalier,"DANS LA COUR INTÉRIEUR DU BÂTIMENT : REMPLACER LES DEUX BALCON, L'ESCALIER ET LA RAMPE D'ACCÈS DU CPE PICASSO AFIN DE LE RENDRE CONFORME ET RÉGLEMENTAIRES",0,-73.61133173435907,45.62413785905975,296118.54,5053810.33,0.057308756
466427,1000236392,1000237592,1992-05-26,1992-05-26,5345  chemin Queen-Mary,Côte-des-Neiges - Notre-Dame-de-Grâce,TR,Transformation,Commercial,Commercial,AMENAGER NOUVELLE RAMPE POUR HANDICAPE DE 6',0,-73.62993349660773,45.48277313369128,294642.57,5038102.44,0.057308756
453264,1000594391,1000594391,1991-10-15,1991-11-26,1196  chemin Remembrance,Ville-Marie,TR,Transformation,Gouvernemental,Edifice gouvernemental,AMENAGEMENT D'UNE RAMPE D'HANDICAPE - CHALET DU MONT-ROYAL,0,-73.59429197312764,45.50316394896145,297431.47,5040364.59,0.057308756
439926,3003659218,3001927362,2026-05-04,2026-05-14,500  avenue Ash,Le Sud-Ouest,CA,Abattage d'arbres,Équi.Colle. et Institutionnels,Équi.Colle. et Institutionnels,"En façade, abattage d'un arbre dans la zone de construction de la rampe d'accès au bâtiment.Un autre arbre sera planté.",0,-73.5568615976328,45.47835688531301,300354.55,5037605.03,0.057308756
443787,3003612187,3001892133,2025-10-28,2025-11-04,1120  rue Beaubien Est,Rosemont - La Petite-Patrie,TR,T3-Transfo.ext. (sans PIIA),Commercial,Commercial,"Au rez-de-chaussée, remplacer la porte desservant le local commercial et modifier la rampe pour l'accessibilité universelle sans obstacle. Tel que documents approuvés.",0,-73.60081406394286,45.5382819808216,296926.7,5044267.91,0.057308756
414172,3003343533,3001674253,2024-02-06,2024-03-01,5250  rue Ferrier,Côte-des-Neiges - Notre-Dame-de-Grâce,TR,Transformation,Commercial,Édifice à bureau,"En cour avant, ajout d'une rampe d'accès pour fauteuils roulants.",0,-73.65661888341798,45.49799256162099,292559.76,5039797.5,0.057308756
104057,3000431589,3000200266,2011-07-20,2011-10-18,3745  boulevard Saint-Laurent,Le Plateau-Mont-Royal,TR,Transformation combinée,Commercial,Commercial,"À L'ARRIÈRE DE LA PHARMACIE AU NIVEAU DE LA RUE ST-DOMINIQUE, AMÉNAGER UNE RAMPE D'ACCÈS EN BÉTON DE 17' 7'' X 9' POUR LIVRAISON DES MARCHANDISES.",0,-73.575091077947,45.51538735828433,298933.21,5041721.41,0.057308756
326715,3003038974,3001427605,2021-07-07,2021-09-02,5323  place Garland,Côte-des-Neiges - Notre-Dame-de-Grâce,TR,Transformation,Institutionnels,Église et Lieux de culte,"En cour avant, remplacer le perron et l'escalier de l'entrée principale et ajouter une rampe d'accessibilité universelle.",0,-73.64511430780277,45.489992940368296,293457.27,5038906.81,0.057308756
388562,3003379043,3001767774,2024-04-17,2024-09-20,951  rue du Marché-Central,Ahuntsic - Cartierville,TR,Transformation,Commercial,Commercial,"Mur latéral, ajouter une porte de garage pour les livraison avec rampe d'accès.",0,-73.6496583154294,45.534217682410166,293111.25,5043822.19,0.057308756
108901,3000262314,3000118506,2010-12-03,2011-02-17,989  avenue de Clifton,Côte-des-Neiges - Notre-Dame-de-Grâce,TR,Transformation,Commercial,Mixte,"Fac Upper-Lachine & Clifton: enlev. rev mét., briques, fen., portes et rempl par nouv parem briques, nouv portes et fen.Réam. intér. majeur des étages. Aj. rampe handic & perron ds cour av Clifton",0,-73.61270563402279,45.4665299179465,295986.81,5036295.3,0.057308756
479,1200000702,1200006208,1993-10-04,1993-10-14,3292  rue Cherrier,L'Île-Bizard - Sainte-Geneviève,TR,Transformation - modification,Institutionnel,Permis ancien système,"EXPIRATION DU PERMIS 14 AVRIL 1994., CONSTRUCTION D'UNE RAMPE POUR, HANDICAPE DONNANT ACCES A LA, TERRASSE EXTERIEUR., CORRECTION SUR PLAN APPROUVE.",0,-73.87001192874526,45.490623595023976,275878.68,5039033.25,0.057308756
439663,3003569479,3001854333,2025-07-23,2025-07-24,8681  boulevard Champlain,LaSalle,TR,TR - Transformation,Communautaire,récréation intensive (p3),"AU RC, DÉMOLIR ET RECONSTRUIRE LA RAMPE D'ACCÈS UNIVERSELLE INCLUANT LE PALIER ET L'ESCALIER À L'ENTRÉE, REMPLACER LA BAIE VITRÉE ENTRE LA PATINOIRE ET LE COULOIR, AINSI QUE RÉNOVER LES TOILETTES, AVEC TRAVAUX DE STRUCTURE, DE MÉCANIQUE ET D'ÉLECTRICITÉ.",0,-73.6227001946478,45.41820304802914,295197.07,5030925.92,0.057308756
493065,1001761898,1000690199,1998-10-13,1999-07-16,3315  chemin Queen-Mary,Côte-des-Neiges - Notre-Dame-de-Grâce,TR,Transformation,Commercial,Édifice à bureau,CONSTRUCTION D'UNE RAMPE DE BETON(HANDICAPEE),0,-73.61767900988141,45.49665485294526,295602.81,5039643.65,0.057308756
365722,3003123195,3001521861,2022-02-02,2022-04-27,4200  rue Saint-Denis,Le Plateau-Mont-Royal,TR,Transformation combinée,Commercial,Mixte,"Suite au permis #3001417461-21, en façade, au RC, remplacer et rehausser les vitrines commerciales. Au bas de la vitrine, installer pierre calcaire Saint-Marc, fini bouchardé. Relocaliser entrée du commerce et créer une alcôve. À l'intérieur, au RC, réaménager partiellement et installer une rampe d'accès universelle. Au toit de l'avant corps, installer une sortie mécanique.",0,-73.57861285741095,45.521696396541415,298658.75,5042422.8,0.057308756
461463,1000284091,1000522591,1991-05-24,1991-10-21,61  boulevard René-Lévesque Ouest,Ville-Marie,TR,Transformation,Commercial,Edifice à bureau,ELARGISSEMENT DE LA RAMPE D'ACCES POUR COUR ARRIERE PAR LA RUE CLARK TEL QUE PLANS AUCUN AUTRE TRAVAIL AUTORISE,0,-73.56217693991256,45.508269157700624,299941.57,5040929.49,0.057308756
461042,1001157000,1001028600,2000-06-23,2000-09-22,6999  chemin de la Côte-des-Neiges,Côte-des-Neiges - Notre-Dame-de-Grâce,TR,Transformation,Commercial,Édifice à bureau,"AU 2 IÈME ET 3 IÈME ÉTAGE, REAMENAGEMENT CORRIDORS + ACCÈS TOILETTES ET AGRANDIR BATIMENT LATÉRALEMENT COTÉ DE COURTRAI POUR ASCENSEUR ET RAMPE",0,-73.63938987360415,45.504253065349786,293907.47,5040490.75,0.057308756
128431,3000692462,3000332251,2013-05-14,2013-05-21,6225  avenue Godfrey,Côte-des-Neiges - Notre-Dame-de-Grâce,TR,Transformation,Institutionnels,Église et Lieux de culte,"AU REZ-DE-CHAUSSÉE ET À L'ÉTAGE, INSTALLATION D'UN ASCENSEUR ET AMÉNAGEMENT D'UNE RAMPE D'ACCÈS. AUCUN TRAVAUX EXTÉRIEURS.",0,-73.62719007686302,45.46797928516362,294854.43,5036458.06,0.057308756
210365,3001148229,3000555057,2016-06-20,2016-07-11,4381  rue King,Pierrefonds - Roxboro,CO,TF- Transformation,public et institutionnel,institutions,"TRAVAUX VISANT L'ACCESSIBILITÉ UNIVERSELLE À L'ÉCOLE GREENDALE - MODIFICATION DE L'ENTRÉE PRINCIPALE, AJOUT DE RAMPES EXTÉRIEURES, MODIFICATION SALLES DE CLASSES ET TOILETTE, AJOUT D'UNE PLATEFORME ÉLÉVATRICE",0,-73.8527566981623,45.48076628116697,277222.59,5037931.74,0.057308756
