_id,no_demande,id_permis,date_debut,date_emission,emplacement,arrondissement,code_type_base_demande,description_type_demande,description_type_batiment,description_categorie_batiment,nature_travaux,nb_logements,longitude,latitude,loc_x,loc_y,rank
472462,1000338391,1000297791,1991-06-14,1991-06-18,271  rue Saint-Zotique Est,Rosemont - La Petite-Patrie,TR,Transformation,Commercial,Mixte,INSTALLER RAMPE HANDICAPE AU RC PAR LA RUE HENRI-JULIEN TEL QUE PLANS AUCUNE MODIFICATION A LA STRUCTURE AUCUN A UTRE TRAVAIL AUTORISE,0,-73.60963160423067,45.534320781451896,296237.47,5043828.6,0.057308756
476672,1000088395,1000261195,1995-01-26,1995-05-05,1080  côte du Beaver Hall,Ville-Marie,TR,Transformation,Commercial,Edifice à bureau,AMENAGEMENT D'UNE RAMPE ET D'UN ASCENSEUR D'HANDICAPE,0,-73.56509300028814,45.50247905412122,299713.19,5040286.22,0.057308756
181622,3001050081,3000543655,2015-08-28,2016-05-18,6100  rue Sherbrooke Ouest,Côte-des-Neiges - Notre-Dame-de-Grâce,TR,Transformation,Commercial,Commercial,"En cour avant, au niveau du rez-de-chaussée, sur Sherbrooke Ouest, construire une rampe d'accès pour personnes handicapées.",0,-73.62137714145031,45.467371370038656,295308.87,5036389.8,0.057308756
452083,1000237992,1000286592,1992-05-27,1992-06-19,777  rue de la Commune Ouest,Ville-Marie,TR,Transformation,Commercial,Commercial,"AMENAGER UN CAFE TERRASSE SANS CONSTRUCTION EN FACADE, RELOCALISER LA   RAMPE D'ACCES HANDICAPES ET FAIRE PORTE DE SERVICE EN FACADE.",0,-73.55296784738125,45.49606418710629,300660.26,5039572.63,0.057308756
378798,3003277445,3001620519,2023-06-05,2023-07-25,7070  boulevard Perras,Rivière-des-Prairies - Pointe-aux-Trembles,TR,Transformation,Gouvernemental,Centre hospitalier,"EN FAÇADE DU BÂTIMENT, REMPLACER LA PORTE PRINCIPALE ET METTRE AUX NORMES LA RAMPE POUR L'ACCÈS UNIVERSEL TEL QUE PLANS APPROUVÉS.  MODIFIER LE MARQUAGE AU SOL DES CASES DE STATIONNEMENT POUR PERSONNES À MOBILITÉ RÉDUITE",0,-73.61133173435907,45.62413785905975,296118.54,5053810.33,0.057308756
474642,1000663690,1000028391,1990-11-27,1991-01-25,5115  rue Rivard,Le Plateau-Mont-Royal,TR,Transformation combinée,Gouvernemental,Edifice gouvernemental,"CONSTRUIRE RAMPE BETON POUR HANDICAPES, NOUVEL ASCENSEUR ET APPENTIS, REAMENAGER TOILETTES POUR LES RENDRE ACCES SIBLES, TEL QUE PLANS ET DEVIS",0,-73.58935096526595,45.52764774613935,297820.62,5043085.06,0.057308756
468126,1000423390,1000347890,1990-08-14,1990-08-14,2000  avenue McGill College,Ville-Marie,TR,Transformation,Commercial,Edifice à bureau,"REMPLACER UN ELEVATEUR HYDROLIQUE ET UNE RAMPE DE BETON PAR UN NOUVEL ESCALIER DEVANT LA VOUTE DE LA BANQUE AU R EZ-DE-CHAUSSEE, TEL QUE PLANS.",0,-73.57364891663478,45.50311945736882,299044.64,5040357.96,0.057308756
467658,1000508190,1000478790,1990-09-25,1990-10-15,3590  boulevard Saint-Laurent,Le Plateau-Mont-Royal,TR,Transformation combinée,Commercial,Commercial,"CONSTRUCTION D'UNE RAMPE POUR HANDICAPES LE LONG DE LA FACADE AV DU BA- TIMENT, SANS AUTRE MODIFICATION INT OU EXT  (SUITE P5270-89) TQP",0,-73.57233866154894,45.51379910427962,299148.1,5041544.71,0.057308756
461114,1000709195,1000402795,1995-06-09,1995-06-22,6757  chemin de la Côte-des-Neiges,Côte-des-Neiges - Notre-Dame-de-Grâce,TR,Transformation,Commercial,Édifice à bureau,AMENAGER UNE RAMPE D'ACCES POUR HANDICAPES,0,-73.63688996707631,45.5029669588678,294102.58,5040347.49,0.057308756
36611,1300022260,1300022212,2000-08-29,2000-08-30,5551  rue Wellington,Verdun,CO,Construction,Commerce,Centre commercial,CONSTRUCTION D'UNE RAMPE POUR HANDICAPÉ,1,-73.56852102509991,45.45168348123897,299440.49,5034641.53,0.057308756
377542,3003284448,3001616455,2023-07-05,2023-07-10,5093  rue de Charleroi,Montréal-Nord,CA,Terrasses commerciales,Commercial,Commercial,"En marge avant secondaire, construire une structure pour une terrasse commerciale de 7,3 m x 2,3 m. En marge avant principale, construire une rampe d'accès et un palier, installer une main courante.",0,-73.62625809339788,45.599596718819875,294950.31,5051084.74,0.057308756
149261,3000768827,3000384003,2014-05-16,2014-07-22,352  rue Sainte-Catherine Ouest,Ville-Marie,TR,Transformation,Commercial,Commercial,"Au SS, aménager une aire de stationnement de 62 unités de stationnement pour automobiles et une rampe d'accès. En façade, rue St-Edward, percer une ouverture pour une porte de garage. En façade, rue Ste-Catherine, remplacer les vitrines et relocaliser une porte. Tels qu'aux plans approuvés.",0,-73.56708984817455,45.50566173734527,299557.44,5040640.04,0.057308756
305391,3002365534,3001182953,2020-10-01,2020-10-27,800  boulevard Gouin Ouest,Ahuntsic - Cartierville,TR,Transformation,Gouvernemental,Edifice gouvernemental,"Ajouter une marquise et une rampe d'accès universel sur le côté latéral ouest du pavillon J qui deviendra l'entrée principale des visiteurs, terrassement et pavés unis autour de l'entrée (±600p2).",0,-73.6848610002995,45.544942671811405,290364.57,5045019.8,0.057308756
260328,3001487498,3000782674,2019-01-15,2019-03-29,1152  avenue du Mont-Royal Est,Le Plateau-Mont-Royal,TR,Transformation combinée,Commercial,Commercial,"En façade au RC à l'angle du bâtiment, remplacer fenêtre par porte centrée flanquée d'un panneau latéral vitrée de chaque côté, remplacer perron et bac de plantation par rampe d'accès universelle, sur installer bacs de plantation en sol sur 2 façades. À l'intérieur au 2e étage, réaménager bureaux.",0,-73.57837193952639,45.52852262781685,298678.31,5043181.39,0.057308756
302184,3002642734,3001265315,2021-02-10,2021-02-12,10985  avenue Alfred,Montréal-Nord,TR,Travaux extérieurs-intérieurs,Public,Publique,"Réfection partielle du pavillon des baigneurs et du chalet de parc: réaménagement des salles de bain et vestiaires, remplacement de portes intérieures et extérieures, ajout de rampes pour personnes handicapées.",0,-73.62223718400057,45.599681742194015,295264.01,5051093.7,0.057308756
365383,3003207373,3001560866,2022-08-31,2022-10-26,2040  boulevard Édouard-Montpetit,Côte-des-Neiges - Notre-Dame-de-Grâce,TR,Transformation,Propriété public,Espace public,"Dans la station de métro Edouard Montpetit, niveau mezzanine, aménager une rampe d'accès universelle. Aucun travaux extérieur.",0,,,,,0.057308756
209790,3001138835,3000543951,2016-05-18,2016-05-20,103  boulevard Marcel-Laurin,Saint-Laurent,CA,ME Modifications Extérieures,INDUSTRIE,I2 Commerce de gros,"MODIFICATIONS EXTÉRIEURES -  NOUVELLE RAMPE D'ACCÈS, MARQUISE ET ENTRÉE",0,-73.6704982196129,45.50480936074136,291476.66,5040557.27,0.057308756
300672,3001735497,3000948853,2019-12-19,2020-02-19,5170  avenue Van Horne,Côte-des-Neiges - Notre-Dame-de-Grâce,TR,Transformation,Institutionnels,École primaire,"Au RDC, façade Van-Horne, agrandir le bâtiment sous la partie en porte à faux et ajouter un perron d'entrée et une rampe d'accès universelle. Réaménager partiellement le rez-de-chaussée.",0,-73.64056277873887,45.49088331417459,293813.21,5039005.13,0.057308756
234100,3001313205,3000659982,2017-06-08,2017-08-18,6215  avenue Godfrey,Côte-des-Neiges - Notre-Dame-de-Grâce,TR,Transformation,Institutionnels,Activités communautaires,"SUR LA FAÇADE GRAND, REMPLACER UNE FENÊTRE PAR UNE PORTE ET AJOUTER UNE RAMPE D'ACCÈS.",0,-73.62708836659596,45.46825720963504,294862.43,5036488.93,0.057308756
232498,3001282766,3000644199,2017-02-14,2017-04-28,5800  rue Saint-Denis,Rosemont - La Petite-Patrie,TR,Transformation,Commercial,Edifice à bureau,"EN COUR AVANT, AMÉNAGER UNE RAMPE D'ACCÈS POUR PERSONNES À MOBILITÉ RÉDUITE ET ESCALIER D'ACCÈS + RÉTENTION INCLUSE.  TEL QUE PLANS.",0,-73.59825152198904,45.53011788646596,297125.71,5043360.38,0.057308756
111600,3000243716,3000098110,2010-08-26,2010-09-20,1000  boulevard Henri-Bourassa Est,Ahuntsic - Cartierville,TR,Transformation,Commercial,Commercial,Modification au permis 3000086723-10 pour déplacer la rampe handicapée extérieure de la cour arrière à la cour avant.,0,-73.6656999903968,45.55969164324773,291864.2,5046655.61,0.057308756
347373,3003211375,3001581793,2022-09-15,2023-02-01,6100  rue Pascal,Montréal-Nord,TR,Transformation,Public,Publique,"En marge avant principale, aménager une rampe d'accès pour personnes handicapées.",0,-73.62235026764972,45.61581159027339,295257.92,5052886.26,0.057308756
409144,3003472677,3001814773,2024-10-18,2025-03-06,180  rue Graveline,Saint-Laurent,TR,TR Transformations Extérieures,INDUSTRIE,I2 Commerce de gros,MODIFICATIONS EXTÉRIEURES - «GO TRANSPORT CANADA» / REMPLACEMENT DU REVÊTEMENT PARTIEL SUR TOUTES LES  FAÇADES - TEINTURE DE LA BRIQUE ET REMPLACEMENT DE FENÊTRES SANS MODIFICATIONS AUX OUVERTURES - REMPLACEMENT DE LA MARQUISE - AMÉNAGEMENT D'UNE ALLÉE PIÉTONNE ET D'UNE RAMPE D'ACCÈS UNIVERSELLE,0,-73.70508591847025,45.474235703002414,288765.18,5037165.93,0.057308756
334712,3002432154,3001287513,2020-10-08,2021-03-12,3685  rue Aylmer,Le Plateau-Mont-Royal,TR,Transformation combinée,Commercial,Edifice à bureau,"Au rez-de-chaussée, installer une génératrice de 800kw et au sous-sol 1, mettre à niveau de l'entrée électrique. Dans la cour intérieure, ajouter 2 portes dont 1 au sous-sol avec rampe d'accès et 1 au  RC. Au RC, ajouter 4 persiennes. Du RC au toit, ajouter une cheminée d'échapement.",0,-73.57890158668538,45.509442590258885,298634.85,5041061.05,0.057308756
227061,3001282835,3000631595,2017-02-14,2017-02-16,705  rue Sainte-Catherine Ouest,Ville-Marie,TR,Travaux intérieurs,Commercial,Commercial,"Au 6e étage, dans la suite 5104 (musée Grevin), remplacer un monte-charge et aménager une rampe d'accès. Tel que plan approuvé.",0,-73.57150461684847,45.50276979427046,299212.17,5040318.95,0.057308756
408167,3003505667,3001810798,2025-01-22,2025-02-21,6640  avenue Somerled,Côte-des-Neiges - Notre-Dame-de-Grâce,TR,Transformation,Commercial,Mixte,"Au rez-de-chaussée, diviser la suite 6640 pour créer deux suites commerciales. Mur avant, remplacer une fenêtre par une porte en modifiant les dimensions de l'ouverture. En cour avant, installer une rampe d'accès.",0,-73.63920744944922,45.466145847989964,293914.39,5036255.87,0.057308756
67426,3000125556,3000042146,2008-12-09,2009-03-24,1600  rue du Havre,Ville-Marie,TR,Transformation,Gouvernemental,Edifice gouvernemental,"En cour avant de la rue du Havre, réaménager l'entrée principale avec rampe d'accès pour fauteuils roulants et installer un équipement mécécanique au sol avec 3 unités de stat. À l'int. au RC, réaménager le hall d'entrée et installer un ascenceur dans le puit existant. Tel qu'aux plans approuvés.",0,-73.548705595951,45.53174528977573,300995.79,5043537.69,0.057308756
351137,3003106018,3001556516,2021-12-17,2022-10-05,475  avenue Bloomfield,Outremont,TR,Transformation,Institutionnel,Enseignement,"Modification au permis 3001035733-20, modification des gradins en façade de l'avenue Saint-Viateur. Modification aux ouvertures. Retrait d'une terrasse dans la cour d'école. Modification de la rampe d'accès dans la cour d'école. Le tout tel que résolution CA22 16 0202.",0,-73.60534733457033,45.5198332682329,296569.97,5042218.14,0.057308756
47298,3000106689,3000441663,2008-06-09,2015-01-23,6560  chemin de la Côte-des-Neiges,Côte-des-Neiges - Notre-Dame-de-Grâce,TR,Transformation,Commercial,Édifice à bureau,"EN FAÇADE, CONSTRUIRE UNE RAMPE D'ACCÈS DIFFÉRENTE DE CELLE DÉJÀ APPROUVÉE PAR LE C.C.U.",0,,,,,0.057308756
337228,3002341835,3001182233,2020-09-23,2020-10-27,99999  rue Wellington,Le Sud-Ouest,CA,Aire de stationnement,Industriel,Industriel,Création d'une entrée charretière (voie d'accès) menant à une rampe d'accès pour véhicules de service. Travaux du REM.,0,-73.5560734824969,45.49371606445621,300417.36,5039311.85,0.057308756
295798,3001605248,3000852315,2019-06-19,2019-08-08,3585  rue Saint-Urbain,Le Plateau-Mont-Royal,TR,T1:Transformation ext/PA/PIIA,Commercial,Commercial,"En façade avant, remplacer les garde-corps existants de la rampe d'accès, par nouveaux en acier soudé, galvanisé à chaud, avec motifs perforés « ajourés », peints de couleur gris anthracite clair et boulonnés aux murets de béton existants. Aucuns travaux intérieurs.",0,-73.5728715034492,45.51268524928244,299106.35,5041420.96,0.057308756
179964,3001056179,3000512199,2015-09-14,2015-10-15,48  4e Sud Avenue,Pierrefonds - Roxboro,CO,CO- construction,public et institutionnel,services,RAMPE D'ACCÈS EXTÉRIEURE POUR PERSONNE HANDICAPÉE,0,-73.80671897896592,45.50887364018282,280833.6,5041040.55,0.057308756
327852,3003045914,3001471153,2021-08-04,2021-12-14,2101  avenue Jeanne-d'Arc,Mercier - Hochelaga-Maisonneuve,TR,Transformation,Gouvernemental,Edifice gouvernemental,"Réfection des finis intérieurs, travaux mineurs systèmes intérieurs, aucun réaménagement intérieur + réfection du revêtement acrylique extérieur de l'ensemble du bâtiment , du mur rideau en façade, des portes et fenêtres + remplacement de la rampe d'accès + réfection des systèmes mécaniques/ ventilation",0,-73.54377195391352,45.55040332058733,301382.26,5045610.96,0.057308756
192085,1710015568,1710015446,2000-09-05,2000-10-31,1500  avenue Dollard,LaSalle,CO,CO - Construction,Commercial,détail et service (c1),MODIFICATION / RAMPE POUR HANDICAPES,0,-73.62823702647279,45.42705006232206,294765.31,5031909.75,0.057308756
376387,3003250205,3001599783,2023-02-21,2023-05-02,1300  rue Sherbrooke Ouest,Ville-Marie,TR,Travaux extérieurs-intérieurs,Commercial,Edifice à bureau,"À tous les niveaux, réaménager en partie les espaces intérieurs en base building. Du sous-sol 3 au rez-de-chaussée, ajouter un ascenseur. Au sous-sol 1, ajouter une rampe d'accès. Du rez-de-chaussée au 7e étage, ajouter 2 ascenseurs et aménager des salles de toilettes. Au 8e étage, ajouter un appentis d'ascenseurs d'environ 22 m². Travaux tels qu'aux plans approuvés.",0,-73.57874473762635,45.49913583004094,298645.99,5039915.64,0.057308756
501798,1000651899,1000486799,1999-03-30,1999-05-18,1951  rue Beaubien Est,Rosemont - La Petite-Patrie,TR,Transformation,Commercial,Mixte,"AU RC, REAMENAGER BANQUE, AGRANDIR RAMPE POUR HANDICAPES DANS MARGE     AVANT.",0,-73.59551311422517,45.544364200774524,297341.49,5044943.33,0.057308756
410398,3003477406,3001809019,2024-10-29,2025-02-11,1819  boulevard René-Lévesque Ouest,Ville-Marie,TR,Travaux extérieurs,Commercial,Mixte,"Au basilaire, remplacer l'entièreté du mur-rideau, des portes et modifier les marquises. Aux étages, remplacer toutes les fenêtres dans les ouvertures existantes. En façade de la rue Saint-Mathieu, ajouter une rampe d'accessibilité universelle. Tels qu'aux plans approuvés.",0,-73.57709475969808,45.49223819326699,298774.2,5039148.98,0.057308756
380124,3003307250,3001637837,2023-09-21,2023-09-28,405  avenue Ogilvy,Villeray - Saint-Michel - Parc-Extension,TR,Transformation,Commercial,Edifice à bureau,"EN FAÇADE, RÉFECTION DE LA RAMPE D'ACCÈS, TEL QUE DOCUMENTS SOUMIS.",0,-73.62537306656186,45.53094316453698,295007.43,5043455.04,0.057308756
159852,3000921616,3000437083,2015-01-05,2015-01-08,1155  rue Sherbrooke Ouest,Ville-Marie,TR,Travaux intérieurs,Commercial,"Hotel, Motel","RC, 1e et 2e sous-sol, refaire la dalle structurale de la rampe d'accès véhiculaire du stationnement intérieur tels que plans approuvés",0,-73.5774739498579,45.501528910656795,298745.56,5040181.49,0.057308756
119684,3000566784,3000321793,2012-08-06,2013-01-29,6290  avenue du Parc,Rosemont - La Petite-Patrie,TR,Transformation,Commercial,Mixte,"AU RDC: REMPLACER FENÊTRES ET PORTE, DANS LES MÊMES OUVERTURES. REMPLACER REVÊTEMENT EXT. MODIFICATION MARQUISE. FAÇADE BEAUBIEN: REMPLACER 3 PORTES GARAGE (PG) PAR PORTES-FENÊTRES, SUPPRIMER RAMPE D'ACCÈS ET 1 PG. AMÉNAGER TERRASSE EXT. + AMÉNAGER STATIONNEMENT + RÉAMÉNAGER UNE PARTIE DU RDC.",0,-73.61251740149906,45.526270632780495,296010.83,5042934.29,0.057308756
322904,3002483874,3001248593,2020-11-17,2021-01-18,12045  rue Notre-Dame Est,Rivière-des-Prairies - Pointe-aux-Trembles,TR,Abattage d'arbres,Gouvernemental,Edifice gouvernemental,ABATTRE UN ARBRE DANS L'IMPLANTATION DE LA RAMPE D'ACCÈS UNIVERSELLE PROJETÉE.,0,-73.4912004610691,45.6409870912213,305485.97,5055676.85,0.057308756
457443,1000008093,1000124393,1993-01-12,1993-05-03,204  place D'Youville,Ville-Marie,TR,Transformation,Commercial,Edifice à bureau,TRANSFORMER BATIMENT COMMERCIAL EN BUREAUX + AMENAGEMENT DU SS AU 4E ET AJOUT D'UN ESCALIER INT + CREUSER RAMPE D'ACCES + MODIF. FENESTRATION,0,-73.55453539214683,45.50233733261689,300538.22,5040269.85,0.057308756
457157,1001631900,1000988800,2000-08-15,2000-09-13,7115  boulevard Saint-Laurent,Rosemont - La Petite-Patrie,TR,Transformation,Gouvernemental,Edifice gouvernemental,"EN FACADE, INSTALLER UNE RAMPE POUR HANDICAPES. AUCUN EMPIETEMENT",0,-73.61694946843011,45.5340602002492,295665.88,5043800.45,0.057308756
456952,1000292899,1000984899,1999-02-11,1999-10-19,15  rue Duke,Ville-Marie,TR,Transformation,Commercial,Commercial,FACADE LA COMMUNE:REAM ACCES EXT. DU SS EN CONSTRUISANT 1 COUR ANGLAISE;REAM ACCES DU RC ET CONST RAMPE D'ACCES AVEC SALLE MECANIQUE SOUS ESCALI,0,-73.55285350130251,45.49523089610544,300669.14,5039480.02,0.057308756
432796,3003652687,3001932270,2026-04-17,2026-06-02,3533  avenue de Kent,Côte-des-Neiges - Notre-Dame-de-Grâce,TR,Transformation,Institutionnels,Parc,Ajouter une rampe d'accès universelle à la piscine la piscine du parc Martin-Luther-King (2270),0,-73.63202585710862,45.503966502574364,294482.87,5040457.94,0.057308756
96474,1600060560,1600039396,2006-07-07,2006-08-28,901   boulevard Décarie,Saint-Laurent,CA,Z-Autre - Const Accessoire HP,COMMERCE DE DÉTAIL,Commercial et Service HP,RAMPE HANDICAPEE (EXTERIEUR)    «STEFAN LISZKOWSKI»  «TD CANADA TRUST»,0,-73.680384268618,45.5130668424443,290706.19,5041476.61,0.057308756
93878,1600070104,1600039922,2007-03-06,2007-04-19,777  boulevard Marcel-Laurin,Saint-Laurent,CA,MO Modif Int & Ext,SERVICE,Institut et Gouv HP,"ACCESSIBILITÉ UNIVERSELLE  (ASCENSEUR, RAMPE, TOILETTES)    «VILLE DE MONTRÉAL/ARRONDISSEMENT»  «MAIRIE DE L'ARRONDISSEMENT»",0,-73.68245283258715,45.50727200547766,290543.1,5040832.99,0.057308756
96192,1600030599,1600036305,2003-06-23,2003-07-07,280   montée de Liesse,Saint-Laurent,CA,MO Modif Int & Ext,COMMERCE DE DÉTAIL,Commercial et Service HP,RAJOUT RAMPE POUR HANDICAPÉES    «A.P. AMENAGEMENT 1997 INC.»  «TRANSPORT LAURENTIEN»,0,-73.70648325166819,45.47848899912163,288657.14,5037638.88,0.057308756
22202,3000055397,3000022606,2006-10-24,2007-05-09,1604  avenue de l' Église,Le Sud-Ouest,TR,Transformation,Équi.Colle. et Institutionnels,Edifice gouvernemental,Réaménagement d'une rampe pour personnes handicapées; agrandissement d'une aire de stationnement donnant sur la rue Angers,0,-73.5849976428083,45.46331498765248,298153.1,5035935.36,0.057308756
28520,3000072569,3000024310,2007-06-18,2007-06-22,6601  boulevard LaSalle,Verdun,CO,Rénovation,Équipement collectif,Institutionnel,Aménagement de l'entrée et modification de la rampe d'accès pour clientèle à mobilité réduite. Travaux au pavillon Burgess.  Suivi et conformité des travaux par la RBQ.,0,-73.58549090694349,45.44246337522307,298112.06,5033618.18,0.057308756
8522,3000011758,3000004685,2005-05-12,2005-06-03,7174  6e Avenue,Villeray - Saint-Michel - Parc-Extension,TR,Transformation,Commercial,Mixte,REMPLACER LA PORTE DE SERVICE DONNANT SUR LA 6ÈME AVENUE PAR UNE DE 48'' DE LARGE ET AMÉNAGER UNE RAMPE D'ACCÈS À CELLE-CI.,0,-73.60022465081123,45.55599995717125,296975.19,5046236.87,0.057308756
6502,3000008932,3000004107,2005-04-11,2005-05-17,15700  boulevard Gouin Ouest,L'Île-Bizard - Sainte-Geneviève,TR,Transformation - modification,Commercial,Services personnels,"RENOVATIONS EXTÉRIEURES:  AJOUT DE 4 FENETRES, D'UNE RAMPE D'HANDICAPÉ, MODIFICATION D'ESCALIER ARRIERE ET ENLEVER LA VERRIERE À L'AVANT",0,-73.86830669398219,45.482226841716084,276007.69,5038099.51,0.057308756
212909,3001133277,3000541922,2016-05-02,2016-05-09,625  rue Saint-Jacques,Ville-Marie,TR,Travaux extérieurs,Commercial,Edifice à bureau,"Tour de la Bourse, réfection de la rampe d'accès au stationnement souterrain tel qu'aux plans approuvés.",0,-73.56193180949798,45.500512980313644,299960.06,5040067.53,0.057308756
344627,3002190874,3001554460,2020-08-04,2022-09-26,2875  rue Hochelaga,Ville-Marie,TR,Travaux extérieurs-intérieurs,Commercial,Commercial,"Au 2e étage,réaménager une partie de l'aire de plancher afin d'agrandir l'espace utilisé par «Lespacemaker» pour les usages d'atelier d'artistes,d'activité communautaire socioculturelle,d'école d'enseignement spécialisé et bureau.Au RC,ajouter un escalier d'issue intérieur,une rampe d'accès extérieur,une porte sur le mur latéral et remplacer les portes d'entrée.Tel que plans.",0,-73.55667591134151,45.539253131232094,300373.84,5044372.45,0.057308756
527067,1001930098,1000998898,1998-11-06,1998-12-02,7480  boulevard Maurice-Duplessis,Rivière-des-Prairies - Pointe-aux-Trembles,TR,Transformation,Commercial,Mixte,"DANS LA COUR ARRIERE, CONSTRUIRE UN ABRI D'AUTOMOBILE SUR MUR DE        FONDATION EXISTANT DE LA RAMPE D'ACCES D'AUTO AU SOUS-SOL",0,-73.5992242171831,45.62518925639514,297062.81,5053925.94,0.057308756
348663,3003100923,3001476834,2021-12-09,2022-01-11,11570  rue Notre-Dame Est,Rivière-des-Prairies - Pointe-aux-Trembles,TR,Transformation,Gouvernemental,Centre hospitalier,EN FACADE: CONSTRUCTION D'UNE RAMPE D'ACCES ET GARDE CORPS POUR PERSONNES A MOBILITÉS REDUITE TEL QUE PLAN,0,-73.49277305022432,45.633804032807724,305363.45,5054878.56,0.057308756
514820,1002552994,1000355894,1994-06-06,1994-06-14,1685  rue Bélanger,Rosemont - La Petite-Patrie,TR,Transformation,Commercial,Commercial,MODIFICATION DU PERRON SUR LE COIN EN BETON ET AJOUT D'UNE RAMPE POUR   HANDICAPEE EN BETON DU COTE DE LA RUE PAPINEAU,0,-73.60367223559602,45.54621706148333,296704.62,5045150.03,0.057308756
353155,3003205682,3001567617,2022-08-24,2022-11-22,7141  rue Sherbrooke Ouest,Côte-des-Neiges - Notre-Dame-de-Grâce,TR,Transformation,Institutionnels,Université,"Pavillon communication et journalisme - Campus Loyola, au 2ème étage, réaménager le laboratoire audio-visuel. Au 1er et 2ème étage, réaménager des locaux à l'usage du laboratoire sans travaux de structure. Mur latérale droit, réaménager la rampe d'accès.",0,-73.64068676763283,45.45857996905534,293797.24,5035415.28,0.057308756
335361,3003048414,3001527974,2021-08-12,2022-05-30,6970  rue Dumas,Le Sud-Ouest,TR,Travaux extérieurs-intérieurs,Équi.Colle. et Institutionnels,Équi.Colle. et Institutionnels,"Travaux extérieurs: Restaurer l'enveloppe de briques et de pierres. Remplacer l'ensemble des fenêtres dont 5 seront agrandies du côté de la rue d'Aragon. Aménager rampe d'accès universel. Ajouter cabanon extérieur. Travaux intérieurs: Réaménager les aires de plancher tel que sur les plans, mise aux normes du système de chauffage et des escaliers d'issue.",0,-73.59634221584568,45.448360135437206,297263.95,5034274.44,0.057308756
432609,3003652637,3001932260,2026-04-16,2026-06-02,6262  avenue Fielding,Côte-des-Neiges - Notre-Dame-de-Grâce,TR,Transformation,Institutionnels,Parc,Ajouter une rampe d'accès universelle à la piscine du Parc de la Confédération (2332),0,-73.6386175860451,45.47191525654455,293961.62,5036896.94,0.057308756
162426,3000986398,3000543815,2015-04-08,2016-05-19,4200  boulevard Saint-Laurent,Le Plateau-Mont-Royal,TR,Transformation combinée,Commercial,Commercial,"Suite au permis 3000216484-11, en façade (boulevard Saint-Laurent), au RC, ajouter une rampe d'accès pour personnes à mobilité réduite et remplacer les portes et les panneaux vitrés de l'entrée principale. À l'intérieur, au RC, réaménager partiellement le hall d'entrée. Tels que plans.",0,-73.58234347049736,45.51791093752004,298366.88,5042002.41,0.057308756
152486,3000732439,3000351263,2013-11-21,2013-12-09,4815  rue Ontario Est,Mercier - Hochelaga-Maisonneuve,TR,Transformation,Commercial,Mixte,"REMPLACER LE PLAFOND PAR PLAFOND SUSPENDU EN TUILES. AGRANDISSEMENT DU VESTIBULE. AJOUT D'UN BUREAU. À L'EXTÉRIEUR, À L'AVANT, AMÉNAGER RAMPE D'ACCÈS HANDICAPÉS. AMÉNAGER NOUVEAU PERRON SUR TERRAIN PRIVÉ. REMPLACER  VITRINES ET LA PORTE, DANS MÊMES OUVERTURES. REMPLACER 2 SUPPORTS D'ENSEIGNES.",0,-73.5367239685505,45.55774973235125,301932.95,5046427.1,0.057308756
415315,3003200845,3001547817,2022-08-08,2022-08-23,4975  rue Levy,Saint-Laurent,TR,TR Transformations Extérieures,INDUSTRIE,I2 Commerce de gros,MODIFICATIONS EXTÉRIEURES - REHAUSSEMENT DE L'ALLÉE VÉHICULAIRE PAR L'AMÉNAGEMENT D'UNE RAMPE D'ACCÈS ET DES MURS DE SOUTENEMENT POUR ACCÉDER AU QUAIS,0,-73.73663172947279,45.49518094326362,286305.6,5039500.35,0.057308756
432474,3003528598,3001885839,2025-04-11,2025-10-10,5220  boulevard Saint-Laurent,Le Plateau-Mont-Royal,TR,A2:Taux implantation inchangé,Commercial,Commercial,"Renoulever permis 3001693734-24: À tous les niveaux, réaménager le musée et ajouter un ascenseur. Au toit, ajouter une cage d'escalier et une terrasse. En façade, au RC, aménager une rampe d'accès et remplacer les vitrines et vestibules d'entrée. À l'arrière, au RC, créer une alcove pour la porte d'issue.",0,-73.59517065795833,45.52388704613603,297365.54,5042667.65,0.057308756
22096,3000055610,3000018359,2006-10-26,2006-10-26,3315  chemin Queen-Mary,Côte-des-Neiges - Notre-Dame-de-Grâce,TR,Transformation,Commercial,Commercial,"Au rc, face a Queen Mary, installer une rampe  pour handicapée en béton tel que permis 593-04",0,-73.61813467645585,45.49659822330107,295567.19,5039637.41,0.057308756
