_id,no_demande,id_permis,date_debut,date_emission,emplacement,arrondissement,code_type_base_demande,description_type_demande,description_type_batiment,description_categorie_batiment,nature_travaux,nb_logements,longitude,latitude,loc_x,loc_y,rank
352725,3003112576,3001540918,2022-01-13,2022-07-22,7644  rue Édouard,LaSalle,TR,AG - Agrandissement,Communautaire,institu. et administratif (p1),"AGRANDISSEMENT EN COUR ARRIÈRE, RECONFIGURATION DE L'ENTRÉE PRINCIPALE ET AMÉNAGEMENT INTÉRIEUR RELIÉS À L'ACCESSIBILITÉ UNIVERSELLE",0,-73.59403777187043,45.43063619248899,297441.91,5032304.58,0.057308756
366081,3003111756,3001515337,2022-01-10,2022-03-31,4257  rue Saint-Denis,Le Plateau-Mont-Royal,TR,T1:Transformation ext/PA/PIIA,Commercial,Mixte,"Au RC, réaménager espace commercial avec modification des cloisons. En façade, remplacer perron béton par plan incliné pour faciliter accessibilité universelle. En arrière au RC, agrandir ouverture et remplacer porte, remplacer dalle de béton. Aucuns travaux de structure.",0,-73.57892620999203,45.52243612185424,298634.35,5042505.03,0.057308756
435673,3003593687,3001909900,2025-09-12,2026-02-23,5830  boulevard Gouin Ouest,Ahuntsic - Cartierville,TR,Transformation,Commercial,Commercial,"À l'avant au sol, remplacer les dalles de béton et pavés unis, retirer les marches en béton et remplacer par des nouveaux pavés surélevés afin d'assurer l'accessibilité aux personnes à mobilité réduite.  TRAVAUX EN CONTINUITÉ AVEC DEMANDE DE PERMIS # 3003593686  -  5810, boulevard Gouin Ouest.",0,-73.72043737196013,45.531896679154464,287582.5,5043577,0.057308756
147665,3000773281,3000423024,2014-06-02,2014-09-30,4890  avenue Carlton,Côte-des-Neiges - Notre-Dame-de-Grâce,TR,Transformation,Institutionnels,École primaire,"AU RDC, RÉAMÉNAGEMENT PARTIEL DES ESPACES INTÉRIEURS ET INSTALLER QUINCAILLERIE D'ACCESSIBILITÉ AUX ENTRÉES. TRAVAUX TELS QUE PLANS.",0,-73.64028125852926,45.49402127907401,293835.82,5039353.81,0.057308756
115487,3000498856,3000224745,2012-02-22,2012-02-22,490  montée de l' Église,L'Île-Bizard - Sainte-Geneviève,TR,Transformation - modification,Institutionnel,Sports - loisirs - culture,RÉNOVATIONS INTÉRIEURES:  RÉAMÉNAGEMENT INTÉRIEUR - ACCESSIBILITÉ UNIVERSELLE,0,-73.88043578306416,45.486852150186,275061.93,5038617.94,0.057308756
183223,3001054955,3000503968,2015-09-10,2015-09-22,1375  rue Grenet,Saint-Laurent,CA,MO Modif Int & Ext,SERVICE,S5 Commun Hum/loisirs (Gouv),MODIFICATIONS INTÉRIEURES ET EXTÉRIEURES; ACCESSIBILITÉ UNIVERSELLE «CENTRE DES LOISIRS DE SAINT-LAURENT»  AUCUN FRAIS DE PERMIS CAR BÂTIMENT DE LA VILLE,0,-73.69060054819546,45.51424111229955,289908.28,5041608.95,0.057308756
128874,3000676163,3000323449,2013-02-05,2013-03-05,850  avenue Émile-Journault,Ahuntsic - Cartierville,TR,Transformation,Gouvernemental,Edifice gouvernemental,Travaux ponctuels de réaménagement visant l'accessibilité universelle de base et travaux d'entretien général et d'amélioration de l'actif existant.,0,-73.63753484710921,45.55132032855393,294061.39,5045721.14,0.057308756
441864,3003605674,3001907382,2025-10-10,2026-01-20,3175  chemin de la Côte-de-Liesse,Saint-Laurent,TR,TR Transformations Intérieures,INDUSTRIE,I2 Commerce de gros,"MODIFICATIONS INTÉRIEURES - «CÉGEP DE SAINT-LAURENT» - AGRANDISSEMENT DE LA SUPERFICIE OCCUPÉE PAR LE CEGEP SAINT-LAURENT AU RDC ET 2 ÈME ÉTAGE: AMÉNAGEMENT DE BUREAUX, HUIT (08) SALLES DE CLASSES, TROIS (03) TOILETTES POUR HOMMES, DEUX (02) TOILETTES POUR FEMMES, UNE (01) TOILETTE À ACCESSIBILITÉ UNIVERSELLE - INSTALLATION DE DEUX PORTES DANS DES SÉPARATIONS COUPE-FEU.",0,-73.65987313025231,45.51565957321357,292309.34,5041761.35,0.057308756
537722,1710020173,1710019886,2015-02-19,2015-03-11,51  avenue Bélanger,LaSalle,CO,CO - Construction,Communautaire,institu. et administratif (p1),MODIFICATION / AJOUT ASCENSEUR/MISE AUX NORMES ACCESSIBILITÉ,0,-73.65418322490311,45.42421601952383,292734.39,5031598.37,0.057308756
142555,3000667459,3000319372,2012-11-19,2012-11-26,10851  avenue Saint-Charles,Ahuntsic - Cartierville,TR,Transformation,Gouvernemental,Edifice gouvernemental,Réaménager la piscine Sophie-Barat pour une accessibilité universelle.,0,-73.66806107031327,45.561242737957116,291680.23,5046828.37,0.057308756
280092,3001666499,3000914973,2019-10-08,2019-12-11,633  boulevard Crémazie Est,Ahuntsic - Cartierville,TR,Transformation,Commercial,Edifice à bureau,"Sur la façade donnant sur Foucher, démolir deux fenêtres pour y installer une porte et remplacer une porte pour y installer une fenêtre. Au rez-de-chaussée, réaménager le vestibule d'entrée pour qu'il soit au niveau du sol et ajouter un accès à la plate-forme élévatrice existante, pour accessibilité universelle.",0,-73.63759354232982,45.54742056618792,294056.06,5045287.76,0.057308756
241630,3001339756,3000666455,2017-09-19,2017-09-22,955  rue Marie-Anne Est,Le Plateau-Mont-Royal,TR,Transformation combinée,Gouvernemental,Edifice gouvernemental,"À l'intérieur, au RC, réaménager les toilettes et vestiaires pour permettre l'accessibilité universel.",0,-73.57789822127697,45.526249038045066,298715.06,5042928.68,0.057308756
245919,3001481801,3000852575,2018-12-18,2019-08-09,4331  boulevard Décarie,Côte-des-Neiges - Notre-Dame-de-Grâce,TR,Transformation,Gouvernemental,Edifice gouvernemental,Agrandir l'édicule de métro en aire de bâtiment et installer des ascenseurs pour accessibilité universelle. Station Villa Maria.,0,,,,,0.057308756
71207,3000175960,3000064569,2010-01-14,2010-03-17,1  rue Notre-Dame Est,Ville-Marie,TR,Transformation,Gouvernemental,Edifice gouvernemental,"À tous les étages, réaménager les espaces communs pour permettre l'accessibilité universelle. Au 4e et 5e étage, modifications aux garde-corps. Tel qu'aux plans approuvés",0,-73.55611681115481,45.506990068730104,300415,5040787,0.057308756
150710,3000747377,3000355345,2014-02-19,2014-03-05,8650  avenue Querbes,Villeray - Saint-Michel - Parc-Extension,TR,Transformation,Gouvernemental,Edifice gouvernemental,"RÉAMÉNAGEMENT INTÉRIEUR : TRANSFORMATION DES BANDES AUTOUR DE LA PATINOIRE POUR ACCESSIBILITÉ UNIVERSELLE. MODIFICATION À LA DALLE SUR SOL, AUX BANCS, ETC. AUCUNE MODIFICATION À LA STRUCTURE, AUCUNE MODIFICATION AUX FAÇADE. VOIR PLANS.",0,-73.64404211315704,45.534184143969256,293549.89,5043817.66,0.057308756
256592,3001329446,3000659921,2017-08-10,2017-08-17,7170  rue Berri,Villeray - Saint-Michel - Parc-Extension,TR,Transformation,Gouvernemental,Edifice gouvernemental,"STATION DE MÉTRO JEAN-TALON, TRAVAUX D'ACCESSIBILITÉ, AJOUT D'UN ASCENSEUR",0,,,,,0.057308756
272250,3001497395,3000761533,2019-02-06,2019-02-07,4718  rue Wellington,Verdun,TR,Transformation,Commerce,Voisinage,Faire l'installation d'un système d'ouvre porte automatique sur la porte d'entrée principale. (Accessibilité universel). Aucune modification à l'apparence de la façade du bâtiment.,0,-73.56718288104365,45.457582925358714,299545.7,5035297.04,0.057308756
239127,3001187671,3000610754,2016-09-21,2016-11-08,120  avenue Duluth Est,Le Plateau-Mont-Royal,TR,Transformation combinée,Gouvernemental,Edifice gouvernemental,"En façade, rez-de-chaussée remplacer 1 porte double par porte simple de 36'' de large pour accessibilité universelle avec panneau latéral, le tout vitré 66'' de haut avec 5 carreaux en aluminium noir, dans la même ouverture.",0,-73.57814819551943,45.51801795473146,298694.65,5042013.98,0.057308756
278716,3001984597,3001436569,2020-05-29,2021-09-30,4501  rue Bannantyne,Verdun,TR,Transformation,Équipement collectif,Institutionnel,INT - Travaux d'amélioration et d'adaptation reliés à l'accessibilité universelle,0,-73.57675121838385,45.4593412431678,298797.56,5035493.11,0.057308756
84547,3000236062,3000094563,2010-07-19,2010-07-20,3175  rue de Rouen,Mercier - Hochelaga-Maisonneuve,TR,Transformation,Gouvernemental,Edifice gouvernemental,RÉALISATION DE DIVERS TRAVAUX RELIÉS  À L'AMÉLIORATION DE L'ACCESSIBILITÉ DU BÂTIMENT  (CONCEPTION SANS OBSTACLES),0,-73.55265043133053,45.5417615453355,300688.4,5044651,0.057308756
279447,3001764454,3000999133,2020-01-21,2020-05-22,5866  avenue Pierre-De Coubertin,Mercier - Hochelaga-Maisonneuve,TR,Agrandissement,Gouvernemental,Edifice gouvernemental,"Phase 1: Agrandissement en aire de bâtiment et divers travaux d'amélioration et d'adaptation reliés à l'accessibilité universelle, le tout tel que plan d'architecte et d'ingénieur.",0,-73.53926045134409,45.573267639747606,301735.77,5048151.72,0.057308756
421875,3003538495,3001842253,2025-05-08,2025-06-03,343  rue Deslauriers,Saint-Laurent,TR,TR Transformations Int / Ext,INDUSTRIE,I2 Commerce de gros,"MODIFICATIONS INTÉRIEURES / EXTÉRIEURES - «ESSILOR CANADA» RÉAMÉNAGEMENT DE L'ESPACE BUREAUX DE LA SUITE 361- AMÉNAGEMENT D'UNE SALLE DE TOILETTE POUR L'ACCESSIBILITÉ UNIVERSELLE DANS LA PARTIE ENTREPÔT & FUSION DES SUITES 343 & 349 / ANNULER LE NUMÉRO CIVIQUE 349, RUE DESLAURIERS",0,-73.66054540357479,45.523952864724585,292258.66,5042683.09,0.057308756
344056,3003188592,3001535994,2022-06-23,2022-07-04,4975  boulevard Gouin Est,Montréal-Nord,CA,Aménagement du terrain,Public,Publique,Déplacement du quai de service flottant de 20 m² plus à l'ouest pour l'accessibilité à la recharge électrique.,0,-73.6391504586805,45.607980288091966,293946.16,5052018.09,0.057308756
182960,3001056436,3000503966,2015-09-15,2015-09-22,2800  rue Cazeneuve,Saint-Laurent,CA,MI Modifications Intérieures,PARC ET ESPACE VERT,P1 Parc,MODIFICATIONS INTÉRIEURES AU PAVILLON DES BAIGNEURS DU «PARC BOURBONNIÈRE» -TRAVAUX D'AMÉLIORATION ET D'ADAPTATION RELIÉS À L'ACCESSIBILITÉ UNIVERSELLE -  AUCUN FRAIS CAR PROPRIÉTÉ DE LA VILLE DE MONTRÉAL,0,-73.70268949414188,45.502128067196935,288960.36,5040265.14,0.057308756
460755,1000446496,1000399896,1996-03-15,1996-05-10,105  rue McGill,Ville-Marie,TR,Transformation,Gouvernemental,Edifice gouvernemental,AMENAGEMENT INTERIEUR POUR ACCESSIBILITE AUX HANDICAPES SUR TOUS LES    ETAGES. INSTALLER AVERTISSEURS D'ALARME STROBOSCOPIQUES.,0,-73.55502607908299,45.49946300322067,300499.66,5039950.45,0.057308756
487445,1000498090,1000585690,1990-09-20,1990-12-03,525  rue du Dominion,Le Sud-Ouest,TR,Transformation,Commercial,Commercial,"REAMENAGEMENT INTERIEUR, MISE AUX NORMES DES ISSUES, ACCESSIBILITE POUR HANDICAPES, MECANIQUE, STRUCTURE, POUR BUR EAUX COMMUNAUTAIRES, TEL PLAN",0,-73.5732140865732,45.48422128474974,299076.7,5038257.77,0.057308756
517919,1000495191,1000540291,1991-08-26,1991-10-30,6100  rue De Pontgravé,Ahuntsic - Cartierville,TR,Transformation,Gouvernemental,Edifice gouvernemental,"AMENAGEMENT DE TOILETTES  AU CLOS LAURENTIEN,SITUE AU R.C.,TEL QUE PLANS (PROJET D'ACCESSIBILITE DES FEMMES EN MILI EU DE TRAVAIL PHASE 111)",0,-73.71500170487997,45.52521375628932,288005.07,5042833.17,0.057308756
463874,1000999897,1000563797,1997-07-04,1997-08-26,4240  rue Ontario Est,Mercier - Hochelaga-Maisonneuve,TR,Transformation,Gouvernemental,Edifice gouvernemental,RENOVATION GENERALE ET ACCESSIBILITE,0,-73.54029619785041,45.55174373725572,301653.73,5045759.78,0.057308756
1996,1200004973,1200008584,2002-05-01,2002-05-05,17  avenue Maple,L'Île-Bizard - Sainte-Geneviève,TR,Transformation - modification,Institutionnel,Permis ancien système,"INSTALLATION D'UN ASCENSEUR, ET TRAVAUX D'ACCESSIBILITE, HANDICAPES., (VOIR PLANS JOINTS)",0,-73.94414002004595,45.4074408416123,270033.53,5029818.56,0.057308756
446002,3003565697,3001867074,2025-07-11,2025-08-25,120  avenue Duluth Est,Le Plateau-Mont-Royal,TR,T4:Transf. int. RBQ/NEXEMP,Institutionnel,Activité communautaire,"Du Sous-sol au RC, ajouter une plateforme élévatrice pour accès sans obstacles, ajouter une nouvelle salle de bain sans obstacles.",0,-73.57814819551943,45.51801795473146,298694.65,5042013.98,0.2241963
48117,3000107070,3000035352,2008-06-11,2008-07-16,2200  rue Jean-Talon Est,Villeray - Saint-Michel - Parc-Extension,TR,Transformation,Gouvernemental,Edifice du culte,"AGRANDIR LE CENTRE BARTHÉLÉMY EN AMÉNAGEMENT UN NOUVEL ACCÈS SANS OBSTACLE ET UN ESCALIER SUR 2 ÉTAGES, REMPLACEMENT DES OUVERTURES EXISTANTES, TRANSFORMATIONS INTÉRIEURES ET DEMANDE DE P.I.I.A.",0,-73.60378517322366,45.5508287147759,296696.46,5045662.54,0.09016734
158620,3000949243,3000442103,2015-01-26,2015-01-26,2021  avenue Union,Ville-Marie,TR,Travaux intérieurs,Commercial,Edifice à bureau,"12e et 14e étage, réaménager les salles de toilettes sans obstacle tels que plans approuvés",0,-73.57126069917022,45.50514010031433,299231.47,5040582.35,0.09016734
368782,3003172033,3001524069,2022-05-02,2022-05-12,8850  avenue Henri-Julien,Ahuntsic - Cartierville,TR,Transformation,Industriel,Industriel,"Renouveler le permis 3001366014-21: agrandissement en hauteur et création d'une mezzanine, aménagement d'un accès sans obstacle et modification d'une construction hors toit.",0,-73.64410610103147,45.54414674018364,293546.88,5044924.82,0.09016734
348018,3003229532,3001584394,2022-11-24,2023-02-13,600  boulevard De Maisonneuve Ouest,Ville-Marie,TR,Travaux intérieurs,Commercial,Edifice à bureau,"Au 8e étage, à la suite 800, réaménager la salle des employés (cafétéria/salle polyvalente) et aménager un accès sans obstacles. Tel que plans approuvés.",0,-73.57041808783396,45.50392264467668,299297.19,5040447,0.09016734
138023,3000669629,3000320594,2012-12-03,2012-12-18,1409  rue de Beaurivage,Mercier - Hochelaga-Maisonneuve,TR,Transformation,Commercial,Mixte,"À L'AVANT REFAIRE L'ESCALIER DE BÉTON (AU MÊME ENDROIT), CONSTRUIRE UN PARCOURS SANS OBSTACLE. REFAIRE LES 2 BALCONS (MÊME ENDROIT, MÊME DIMENSION)",0,-73.51008404448223,45.58982111999036,304013.18,5049990.65,0.09016734
472968,1000429596,1000467396,1996-03-13,1996-05-30,6805  avenue de Chester,Côte-des-Neiges - Notre-Dame-de-Grâce,TR,Transformation,Gouvernemental,Edifice du culte,"AMENAGEMENT D'AIRES DE PLANCHER SANS OBSTACLE AU SOUS-SOL, REZ DE CHAUS-SEE ET 2E ETAGE",0,-73.64812088857548,45.4673917989083,293217.64,5036395.58,0.09016734
244967,3001358090,3000679093,2017-11-14,2017-11-16,5252  boulevard De Maisonneuve Ouest,Côte-des-Neiges - Notre-Dame-de-Grâce,TR,Transformation,Commercial,Commercial,"En cour arrière et latérale Est, aménager un nouveau trottoir dans un parcours sans obstacles. Ajout d'ouvrages de rétention dans cette partie.",0,-73.6046178203406,45.47334756205756,296620.23,5037052.09,0.09016734
119437,3000531078,3000243787,2012-06-14,2012-07-16,2160  rue de la Montagne,Ville-Marie,TR,Transformation,Commercial,Commercial,"RC, réaménager l'entrée principale avec accès sans obstacle, modifier le revêtement extérieur et agrandir la fenestration tel que plans approuvés",0,-73.57815743158248,45.49910511409033,298691.88,5039912.18,0.09016734
441778,3003582802,3001927368,2025-08-19,2026-05-14,500  avenue Ash,Le Sud-Ouest,TR,Travaux extérieurs,Équi.Colle. et Institutionnels,Équi.Colle. et Institutionnels,"En façade, démolition et reconstruction du vestibule d'entrée. Agrandissement et aménagement d'une entrée sans obstacles.",0,-73.5568615976328,45.47835688531301,300354.55,5037605.03,0.09016734
274645,3001899034,3001022573,2020-04-23,2020-06-15,1851  rue Mullins,Le Sud-Ouest,TR,Transformation,Équi.Colle. et Institutionnels,Équi.Colle. et Institutionnels,"Réaménagement de l'accès sans obstacle, tel-que plan approuvés.Travaux de réamenagement extérieurs.",0,-73.5617665500932,45.480914668929906,299971.3,5037889.56,0.09016734
67687,3000129043,3000041379,2009-02-03,2009-02-19,3681  boulevard Saint-Laurent,Le Plateau-Mont-Royal,TR,Transformation combinée,Commercial,Mixte,"EN FACADE AU NIVEAU DU R.C: MODIFIER L'EMPLACEMENT DE LA PORTE DU COMMERCE,  AMENAGER ACCES SANS OBSTACLE, REAMENAGEMENT  PARTIEL  DU RESTAURANT EXISTANT.",0,-73.57399207018496,45.51477869584567,299019.01,5041653.69,0.09016734
283711,3001424896,3000852123,2018-05-22,2019-08-08,5800  chemin de la Côte-des-Neiges,Côte-des-Neiges - Notre-Dame-de-Grâce,TR,Transformation,Gouvernemental,Centre hospitalier,"RÉUNIR LES COMPTES FONCIERS 49089401 ET 48179112.   AU PAVILLON «N», AMÉNAGER LES COURS FACE À CÔTE-DES-NEIGES, COURS LATÉRALES ET ARRIÈRE,  AMÉNAGER UN ACCÈS SANS OBSTACLE EXTÉRIEUR ET DES AIRES DE STATIONNEMENT AUTOMOBILES DE 18 UNITÉS.",0,-73.62970167149594,45.499232589768745,294663.64,5039931.56,0.09016734
3497,1000261204,3000019926,2004-03-02,2007-01-08,7200  rue Notre-Dame Est,Mercier - Hochelaga-Maisonneuve,CO,Construction,Industriel,Dépendance,AMENAGER UNE GUERITE DE 22' X 15' AVEC SALLE DE TOILETTE SANS OBSTACLE POUR LE STATIONNEMENT DU CÔTÉ EST DU BÂTIMENT .,0,,,,,0.09016734
529942,1000335996,1000306996,1996-02-23,1996-04-17,1615  avenue Émile-Journault,Ahuntsic - Cartierville,TR,Transformation,Gouvernemental,Centre hospitalier,REAMENAGEMENT DE L'ACCES SANS OBSTACLE ET L'ENTREE PRINCIPALE (ISSUE),0,-73.63529624859868,45.55780878025762,294237.39,5046441.91,0.09016734
274086,3001661474,3000885833,2019-10-02,2019-10-16,5969  rue de Verdun,Verdun,TR,Transformation,Commerce,Voisinage,"Aménagement d'une clinique de consultation médicale. Reconfigurer afin d'avoir l'entrée principale sur la rue Brault (porte existante), incluant l'aménagement d'un accès sans obstacle.",0,-73.57309445185635,45.44747177386122,299082.34,5034173.8,0.09016734
467756,1001442003,1000027404,2003-09-30,2004-01-22,800  rue De La Gauchetière Ouest,Ville-Marie,TR,Transformation,Commercial,Commercial,AMENAGER UN PARCOURS SANS OBSTACLES A L'ENTRÉE PRINCIPALE ET REFAIRE    L'ESCALIER DE BÉTON.AUCUNE OCCUPATION DU DOMAINE PUBLIC.,0,-73.56544976479883,45.5005329889702,299685.13,5040069.97,0.09016734
496284,1000062403,1000029703,2003-01-21,2003-01-30,500  boulevard René-Lévesque Ouest,Ville-Marie,TR,Transformation,Gouvernemental,Edifice gouvernemental,REMISE AUX NORMES POUR PARCOURS SANS OBSTACLES (SS-RC-15E) ET AMENAGER  BUREAUX  POUR L'O.P.H.Q. AU 17E ETAGES.,0,-73.56624624964613,45.503164340733974,299623.13,5040362.45,0.09016734
131922,3000692173,3000330823,2013-05-13,2013-05-14,2200  rue Sainte-Catherine Est,Ville-Marie,TR,Transformation,Gouvernemental,Edifice gouvernemental,"En cour avant face au stationnement, remplacer l'accès sans obstacle tels que plans approuvés",0,-73.54785078123754,45.526295135043775,301062.19,5042931.97,0.09016734
111226,3000254121,3000110064,2010-11-02,2010-12-21,3155  boulevard de l' Assomption,Mercier - Hochelaga-Maisonneuve,TR,Transformation,Commercial,Edifice à bureau,INSTALLATION D'UN APPAREIL ÉLÉVATEUR POUR PERSONNES HANDICAPÉES ENTRE LE REZ-DE-CHAUSSÉE ET LE DEUXIÈME ÉTAGE DANS HALL D'ENTRÉE. (AUCUNE OUVERTURE DANS LA DALLE) AMÉNAGEMENT PAYSAGERS À L'EXTÉRIEUR AU NIVEAU DU SOL POUR PERMETTRE PARCOURS SANS OBSTACLES.,0,-73.5482549573466,45.57005342156977,301033.54,5047794.91,0.09016734
342011,3003140365,3001502234,2022-03-08,2022-03-09,6611  rue Saint-Hubert,Rosemont - La Petite-Patrie,TR,Transformation,Commercial,Mixte,AMÉNAGEMENT INTÉRIEUR DU RDC : DEUX TOILETTES DONT UNE SANS OBSTACLE TEL QUE DOCUMENTS APPROUVÉS. AUCUN TRAVAUX DE STRUCTURE.,0,-73.60482890597245,45.537191398572254,296612.99,5044147.11,0.09016734
337964,3002659875,3001303573,2021-02-22,2021-04-01,8666  avenue de Chaumont,Anjou,TR,Transformation,Commerce,Bâtiment commercial,Installer 4 opérateurs électriques dans les portes d'entrée et sortie principale du commerce afin d'aménager un accès sans obstacle (Pharmacie),0,-73.54720621408333,45.6100897331243,301118.02,5052244.18,0.09016734
320740,3002618875,3001366014,2021-02-02,2021-05-26,8850  avenue Henri-Julien,Ahuntsic - Cartierville,TR,Transformation,Industriel,Industriel,Agrandissement en hauteur et création d'une mezzanine.  Aménagement d'un accès sans obstacle et modification d'une construction hors toit.,0,-73.64410610103147,45.54414674018364,293546.88,5044924.82,0.09016734
175679,3001085163,3000519816,2015-11-04,2015-11-09,15748  boulevard de Pierrefonds,Pierrefonds - Roxboro,CO,TF- Transformation,commercial,type détails et services,AMÉNAGEMENT INTÉRIEUR POUR UN GYMNASE (A2) - CONSTRUCTION DE DEUX VESTIAIRES POUR FEMME ET HOMME (SANS OBSTACLE).,0,-73.86629417977431,45.47882034614817,276163.29,5037720.22,0.09016734
266965,3001422836,3000734318,2018-05-14,2018-08-14,55  circuit Gilles-Villeneuve,Ville-Marie,TR,Travaux extérieurs-intérieurs,Gouvernemental,Edifice gouvernemental,"Mise à niveau des stations de pompage Lift 2, 4 et 5 et ajouter de 3 cabinets pour distribution électrique et instrumentation tels qu'aux documents approuvés.",0,-73.52662398878554,45.50650061911331,302719.57,5040731.42,0.057308756
272148,3001423352,3000734316,2018-05-15,2018-08-14,55  circuit Gilles-Villeneuve,Ville-Marie,DE,Démolition,Gouvernemental,Dépendance,"Au lift 4, démolir l'abri principal de la station de pompage et le cabanon élctrique adjacent tels qu'aux documents approuvés.",0,-73.52662398878554,45.50650061911331,302719.57,5040731.42,0.057308756
89368,1600080813,1600041393,2008-11-11,2009-04-02,500   montée de Liesse,Saint-Laurent,CA,Z - Enseigne HP,INDUSTRIE,Industriel HP,ENSEIGNE SUR POTEAU    «TOP LIFT ENTREPRISES INC.»,0,-73.70938109959248,45.47974760754396,288430.95,5037779.33,0.057308756
522846,1000532501,1000458701,2001-04-02,2001-05-07,1660  boulevard Henri-Bourassa Est,Ahuntsic - Cartierville,TR,Transformation,Commercial,Commercial,"ENLEVER LA MARQUISE,POMPE RESERVOIRS ET EQUIPEMENTS PETROLIER           ENLEVER DANS BATIMENT INTERCEPTEUR DE PLANCHER ET 2 LIFT A AUTO",0,-73.66011186289556,45.56675858485824,292302.01,5047440.08,0.057308756
266012,3001422805,3000734317,2018-05-14,2018-08-14,99999  rue Ile Sainte-Hélène,Ville-Marie,TR,Travaux extérieurs-intérieurs,Gouvernemental,Edifice gouvernemental,"Mise à niveau de la station de pompage Lift 3, ajouter 3 tourelles et un cabinet pour distribution électrique et instrumentation tels qu'aux documents approuvés.",0,-73.53407785629123,45.514112667915704,302137.47,5041577.57,0.057308756
535097,1600070752,1600040487,2007-11-01,2007-12-14,3430   rue Griffith,Saint-Laurent,CA,MI Modifications Intérieures,INDUSTRIE,Industriel HP,AMELIORATION MODIFICATION INTERIEURE   «LE GROUPE CONSTRUCTIONS RELIANCE»  «RYDER J.M. LIFT TRUCKS»,0,-73.69397786986868,45.488565957443974,289637.51,5038756.29,0.057308756
147382,3000772273,3000399823,2014-05-29,2014-08-12,6555  chemin de la Côte-de-Liesse,Saint-Laurent,CA,MI Modifications Intérieures,INDUSTRIE,I2 Commerce de gros,"MODIFICATIONS INTÉRIEURES «A1 RENT A TOOL», «TOP LIFT» (SUBDIVISION DE SUITES)",0,-73.69346814799536,45.48569987052434,289676.59,5038437.69,0.057308756
134761,3000689452,3000341289,2013-05-06,2013-07-29,505  rue Sherbrooke Est,Le Plateau-Mont-Royal,TR,Transformation combinée,Commercial,Commercial,"AU SOUS-SOL 1 (ELEVATION 125) REFAIRE LA DALLE DE PLANCHER. MISES AUX NORMES DES 2 NIVEAUX DE STATIONNEMENT. RÉAMÉNAGEMENT POUR DISTANTCE DE PARCOURS, AJOUT DE SAS AUX ESCALIERS. SUR LES ÉTAGES 2 À 6, AJOUT DE PORTES POUR LES ASCENSEURS.",0,-73.56723475262324,45.518580092815455,299547.32,5042075.67,0.057308756
504038,1000196293,1000230793,1993-05-14,1993-07-05,760  rue Saint-Zotique Est,Rosemont - La Petite-Patrie,TR,Transformation,Commercial,Commercial,"TRANSFORMER BAT. COMMERCIAL VACANT EN ECOLE PRIVEE DE MASSOTHERAPIE     MAX.40 ELEVES ADULTES A LA FOIS, AMENAGER ACCES POUR HANDICAPES AU RDC.",0,-73.60707046341653,45.53711300312352,296437.92,5044138.63,0.057308756
387904,3003229684,3001579117,2022-11-25,2023-01-23,3777  rue Jean-Brillant,Côte-des-Neiges - Notre-Dame-de-Grâce,TR,Transformation,Gouvernemental,Centre hospitalier,"Pavillon Hayes, du sous-sol au 4e étage, réaménager partiellement les aires de plancher (salles d'archives et salles d'examens) et remplacer l'ascenseur existant avec travaux de structure. Au toit, remplacer la porte de la cage d'ascenseur.",0,-73.62376956610616,45.49498486540797,295126.52,5039458.78,0.0706241
450358,1000823300,1000850500,2000-05-12,2000-07-21,1175  rue Sherbrooke Ouest,Ville-Marie,TR,Transformation,Commercial,Commercial,REMPLACER ASCENSEUR EXISTANT DESUET PAR NOUVEL ASCENSEUR AGRANDIE DESSERVANT LE REZ-DE-CHAUSSEE ET LE 2E ETAGE,0,-73.57735579105193,45.50104011109038,298754.74,5040127.16,0.0706241
464409,1002248201,1001175401,2001-12-05,2001-12-06,1  place Ville-Marie,Ville-Marie,TR,Transformation,Commercial,Edifice à bureau,"AU NIVEAU 110, RÉAMÉNAGER LE HALL DES ASCENSEURS ET REFAIRE MUR DONNANT FACE AUX ASCENSEURS.",0,-73.57009033252882,45.50145280568291,299322.56,5040172.5,0.0706241
176382,3001113537,3000541434,2015-12-23,2016-05-04,7955  rue Sherbrooke Est,Mercier - Hochelaga-Maisonneuve,TR,Transformation,Gouvernemental,Edifice gouvernemental,ÉDICULE NORD : AGRAND. EN AIRE DE BÂT. POUR AJOUT ASCENSEUR. RÉFECTION MEMBRANES (BLANCHES) DE TOIT (3 ÉDICULES) RÉAMÉNAGEMENT EXTÉRIEUR (PAYSAGER+ÉCLAIRAGE) AJOUT DE 2 ASCENSEURS INTÉRIEURS. DÉPLACER LA PORTE D'ACCÈS DE L'ÉDICULE SHERBROOKE. AJOUTER ÉQUIPEMENTS MÉCANIQUES SUR POSTE DE VENTILATION.,0,,,,,0.0706241
160436,3000985028,3000455240,2015-04-02,2015-04-07,201  avenue Laurier Est,Le Plateau-Mont-Royal,TR,Transformation combinée,Commercial,Commercial,"Au 5e étage, réaménager partiellement les bureaux de la Ville de Montréal. Devant ascenseurs réaménager comptoir d'accueil et salle d'attente. Refaire les cloisons du corridor. Section derrière les ascenseurs, aménager un bureau d'infirmerie et réaménager deux postes de travail. Aucun travaux ext.",0,-73.59164365359479,45.525642684263296,297641.28,5042862.43,0.0706241
